movie_id,title,original_language,popularity,vote_average,vote_count,runtime,budget,revenue,director,release_date,release_year,release_month,budget_category,rating_category,status,tagline,overview,decade
1470130,The Mortuary Assistant,en,30.0264,5.518,113,91,0,1300011,Jeremiah Kipp,2026-02-13,2026.0,2.0,Unknown,Average,Released,Alone with the dead.,"Rebecca Owens, a recent mortuary science graduate takes a night shift job at River Fields Mortuary. Initially, the job seems straightforward — embalming bodies, completing paperwork, and keeping things tidy. But once Rebecca starts working the night shift, things take a dark turn.",2020s
1061474,Superman,en,29.7777,7.3,4838,130,225000000,618723803,James Gunn,2025-07-09,2025.0,7.0,Blockbuster,Good,Released,Look up.,"Superman, a journalist in Metropolis, embarks on a journey to reconcile his Kryptonian heritage with his human upbringing as Clark Kent.",2020s
1137129,Pedro Had a Horse,pt,29.7355,8.5,2,24,0,0,Daniel Nolasco,2023-11-10,2023.0,11.0,Unknown,Excellent,Released,,"While Pedro Américo denies having fabricated fake news, Paulo Setubal reveals the Emperor’s innermost secrets.",2020s
1306368,The Rip,en,29.6492,7.073,1655,113,100000000,0,Joe Carnahan,2026-01-13,2026.0,1.0,High,Good,Released,Count the money. Count it again. Count on no one.,"Trust frays when a team of Miami cops discovers millions in cash inside a run-down stash house, calling everyone — and everything — into question.",2020s
569094,Spider-Man: Across the Spider-Verse,en,29.4885,8.3,8653,140,100000000,690897910,Justin K. Thompson,2023-05-31,2023.0,5.0,High,Excellent,Released,It's how you wear the mask that matters.,"After reuniting with Gwen Stacy, Brooklyn’s full-time, friendly neighborhood Spider-Man is catapulted across the Multiverse, where he encounters the Spider Society, a team of Spider-People charged with protecting the Multiverse's very existence. But when the heroes clash on how to handle a new threat, Miles finds himself pitted against the other Spiders and must set out on his own to save those he loves most.",2020s
329505,Lola's Secret,it,29.2137,7.0,71,88,0,0,Bruno Gaburro,1984-05-04,1984.0,5.0,Unknown,Good,Released,,Young man has his dreams come true when the sexy new maid seduces him. But she also has a secret that leads to trouble.,1980s
808,Shrek,en,29.2116,7.764,18801,90,60000000,488977919,Andrew Adamson,2001-05-18,2001.0,5.0,High,Good,Released,The greatest fairy tale never told.,"It ain't easy bein' green -- especially if you're a likable (albeit smelly) ogre named Shrek. On a mission to retrieve a gorgeous princess from the clutches of a fire-breathing dragon, Shrek teams up with an unlikely compatriot -- a wisecracking donkey.",2000s
425274,Now You See Me: Now You Don't,en,29.1067,6.505,1549,113,90000000,242431024,Ruben Fleischer,2025-11-12,2025.0,11.0,High,Average,Released,Unlock the illusion.,"The original Four Horsemen reunite with a new generation of illusionists to take on powerful diamond heiress Veronika Vanderberg, who leads a criminal empire built on money laundering and trafficking. The new and old magicians must overcome their differences to work together on their most ambitious heist yet.",2020s
1628367,Kartavya,hi,29.0514,6.5,19,109,0,0,Pulkit,2026-05-15,2026.0,5.0,Unknown,Average,Released,,"With his family's safety at stake and menacing threats closing in, a police officer must decide how far he'll go to uphold his duty.",2020s
1653208,The Great Grand Superhero,hi,29.011,0.0,0,112,0,0,Manish Saini,2026-05-29,2026.0,5.0,Unknown,Poor,Released,Aliens Ka Aagman,,2020s
22,Pirates of the Caribbean: The Curse of the Black Pearl,en,26.4101,7.8,22278,143,140000000,655011224,Gore Verbinski,2003-07-09,2003.0,7.0,High,Good,Released,Prepare to be blown out of the water.,"When wily pirate Captain Barbossa seizes Jack Sparrow’s beloved ship, the Black Pearl, and kidnaps the governor’s daughter, Elizabeth Swann, blacksmith Will Turner reluctantly teams up with the unpredictable pirate Jack to rescue her—only to uncover a terrifying curse that turns Barbossa’s crew into the undead.",2000s
575265,Mission: Impossible - The Final Reckoning,en,29.0085,7.166,2845,170,400000000,598767057,Christopher McQuarrie,2025-05-17,2025.0,5.0,Blockbuster,Good,Released,Our lives are the sum of our choices.,"Ethan Hunt and team continue their search for the terrifying AI known as the Entity — which has infiltrated intelligence networks all over the globe — with the world's governments and a mysterious ghost from Hunt's past on their trail. Joined by new allies and armed with the means to shut the Entity down for good, Hunt is in a race against time to prevent the world as we know it from changing forever.",2020s
497,The Green Mile,en,28.9775,8.507,19307,189,60000000,286801374,Frank Darabont,1999-12-10,1999.0,12.0,High,Excellent,Released,Paul Edgecomb didn't believe in miracles. Until the day he met one.,"A supernatural tale set on death row in a Southern prison, where gentle giant John Coffey possesses the mysterious power to heal people's ailments. When the cell block's head guard, Paul Edgecomb, recognizes Coffey's miraculous gift, he tries desperately to help stave off the condemned man's execution.",1990s
405746,Door,ja,28.9436,6.0,26,94,0,0,Banmei Takahashi,1988-05-14,1988.0,5.0,Unknown,Average,Released,,"Yasuko, a housewife, lives in an urban high-rise apartment with her husband Satoru and her son Takuto.  Annoyed by spam calls and door-to-door salesmen, Yasuko slams the door on a salesman’s hand when he tries to squeeze a flyer through the apartment's chained front door. He leaves, but the next day, her nightmare starts.",1980s
372058,Your Name.,ja,28.9041,8.481,12603,106,7500000,405320132,Makoto Shinkai,2016-08-26,2016.0,8.0,Low,Excellent,Released,"Separated by distance, connected by fate.","High schoolers Mitsuha and Taki are complete strangers living separate lives. But one night, they suddenly switch places. Mitsuha wakes up in Taki’s body, and he in hers. This bizarre occurrence continues to happen randomly, and the two must adjust their lives around each other.",2010s
11649,Masters of the Universe,en,28.8314,5.8,1029,106,22000000,17336370,Gary Goddard,1987-08-07,1987.0,8.0,Medium,Average,Released,A battle fought in the stars...now comes to Earth.,"When the evil Skeletor finds a mysterious power called the Cosmic Key, he becomes nearly invincible, seizing Castle Grayskull and the surrounding city. The Sorceress is now Skeletor's prisoner and he begins to drain her life-force as he waits for the moon of Eternia to align with the Great Eye of the Universe which will bestow god-like power upon him. However, courageous warrior He-Man locates the locksmith inventor Gwildor, who created the Key and has another version of it. During a battle, one of the Keys is transported to Earth, where it is found by teenagers Julie and Kevin. Now, both He-Man and Skeletor's forces arrive on Earth searching for the potent weapon.",1980s
1383731,Protector,en,28.6545,8.018,191,90,0,1969113,Adrian Grünberg,2026-02-20,2026.0,2.0,Unknown,Excellent,Released,Mother. Savior. Killer...,"Nikki's life is shattered when her daughter is kidnapped. Thrust into the criminal underworld while hunted by cops and military, she must fight to rescue her child.",2020s
121,The Lord of the Rings: The Two Towers,en,28.5753,8.42,23947,179,79000000,926287400,Peter Jackson,2002-12-18,2002.0,12.0,High,Excellent,Released,The journey continues.,"Frodo Baggins and the other members of the Fellowship continue on their sacred quest to destroy the One Ring--but on separate paths. Their destinies lie at two towers--Orthanc Tower in Isengard, where the corrupt wizard Saruman awaits, and Sauron's fortress at Barad-dur, deep within the dark lands of Mordor. Frodo and Sam are trekking to Mordor to destroy the One Ring of Power while Gimli, Legolas and Aragorn search for the orc-captured Merry and Pippin. All along, nefarious wizard Saruman awaits the Fellowship members at the Orthanc Tower in Isengard.",2000s
484503,The Black Pearl,zh,28.4726,0.0,0,0,0,0,Yao Feng-Pan,1982-01-01,1982.0,1.0,Unknown,Poor,Released,,"Women are beaten, raped, tortured and killed in brutal prison.",1980s
361743,Top Gun: Maverick,en,28.2079,8.158,11019,131,170000000,1488732821,Joseph Kosinski,2022-05-21,2022.0,5.0,Blockbuster,Excellent,Released,Feel the need... The need for speed.,"After more than thirty years of service as one of the Navy’s top aviators, and dodging the advancement in rank that would ground him, Pete “Maverick” Mitchell finds himself training a detachment of TOP GUN graduates for a specialized mission the likes of which no living pilot has ever seen.",2020s
396535,Train to Busan,ko,28.1614,7.749,8399,118,8500000,87547518,Yeon Sang-ho,2016-07-20,2016.0,7.0,Low,Good,Released,Life-or-death survival begins.,"When a zombie virus pushes Korea into a state of emergency, those trapped on an express train to Busan must fight for their own survival.",2010s
1022789,Inside Out 2,en,28.1468,7.546,6705,97,200000000,1698863816,Kelsey Mann,2024-06-11,2024.0,6.0,Blockbuster,Good,Released,Make room for new emotions.,"Teenager Riley's mind headquarters is undergoing a sudden demolition to make room for something entirely unexpected: new Emotions! Joy, Sadness, Anger, Fear and Disgust, who’ve long been running a successful operation by all accounts, aren’t sure how to feel when Anxiety shows up. And it looks like she’s not alone.",2020s
1207162,Rise of the Conqueror,en,28.1123,6.063,16,119,30000000,0,Jacob Schwarz,2026-04-09,2026.0,4.0,Medium,Average,Released,His legacy will be written in fire and blood.,"In the 14th-century, as the Silk Road crumbles and rival factions tear the land apart, fearless warrior Timur emerges from exile. Stripped of everything, he fights to unite the fractured kingdoms, using strategy and sheer will to carve an empire from chaos. Undefeated in battle and widely regarded as one of history’s greatest military leaders and tacticians, not to mention one of its most brutal, Timur would found the Timurid Empire, which ruled over modern-day Afghanistan, Iran and Central Asia.",2020s
1156593,Your Fault,es,28.0827,7.083,1560,117,0,0,Domingo González,2024-12-26,2024.0,12.0,Unknown,Good,Released,Divided by family. Driven by love.,The love between Noah and Nick seems unwavering despite their parents' attempts to separate them. But his job and her entry into college open up their lives to new relationships that will shake the foundations of both their relationship and the Leister family itself.,2020s
13,Forrest Gump,en,28.0127,8.465,29813,142,55000000,677387716,Robert Zemeckis,1994-06-23,1994.0,6.0,High,Excellent,Released,The world will never be the same once you've seen it through the eyes of Forrest Gump.,"A man with a low IQ has accomplished great things in his life and been present during significant historic events—in each case, far exceeding what anyone imagined he could do. But despite all he has achieved, his one true love eludes him.",1990s
863,Toy Story 2,en,26.3956,7.609,14916,92,90000000,497375404,John Lasseter,1999-10-30,1999.0,10.0,High,Good,Released,The toys are back!,"Andy heads off to Cowboy Camp, leaving his toys to their own devices. Things shift into high gear when an obsessive toy collector named Al McWhiggen, owner of Al's Toy Barn kidnaps Woody. Andy's toys mount a daring rescue mission, Buzz Lightyear meets his match and Woody has to decide where he and his heart truly belong.",1990s
216015,Fifty Shades of Grey,en,27.9782,5.868,12397,125,40000000,569651467,Sam Taylor-Johnson,2015-02-11,2015.0,2.0,Medium,Average,Released,Mr. Grey will see you now.,"When college senior Anastasia Steele steps in for her sick roommate to interview prominent businessman Christian Grey for their campus paper, little does she realize the path her life will take. Christian, as enigmatic as he is rich and powerful, finds himself strangely drawn to Ana, and she to him. Though sexually inexperienced, Ana plunges headlong into an affair -- and learns that Christian's true sexual proclivities push the boundaries of pain and pleasure.",2010s
61823,The Ape Woman,it,27.9724,7.3,59,92,0,0,Marco Ferreri,1964-01-31,1964.0,1.0,Unknown,Good,Released,,A modest Neapolitan man meets a young woman with excessive hairiness. He exhibits her at fairs and marries her. It is after marriage that he receives a tempting offer from a French manager.,1960s
1084577,Balls Up,en,27.9489,5.885,256,104,0,0,Peter Farrelly,2026-04-15,2026.0,4.0,Unknown,Average,Released,Their survival takes a big pair.,"Two marketing executives go ""balls out"" and pitch a bold full‑coverage condom sponsorship with the World Cup. After their drunken celebration in Brazil sparks a global scandal, they must outrun furious fans, criminals, and power-hungry officials to salvage their careers and make it home alive.",2020s
550,Fight Club,en,27.8653,8.438,32119,139,63000000,100853753,David Fincher,1999-10-15,1999.0,10.0,High,Excellent,Released,Mischief. Mayhem. Soap.,"A ticking-time-bomb insomniac and a slippery soap salesman channel primal male aggression into a shocking new form of therapy. Their concept catches on, with underground ""fight clubs"" forming in every town, until an eccentric gets in the way and ignites an out-of-control spiral toward oblivion.",1990s
829557,365 Days: This Day,pl,27.6761,5.94,1847,110,0,0,Barbara Białowąs,2022-04-26,2022.0,4.0,Unknown,Average,Released,Oh Yes.,"Laura and Massimo are back and hotter than ever. But the reunited couple's new beginning is complicated by Massimo’s family ties and a mysterious man who enters Laura’s life to win her heart and trust, at any cost.",2020s
1242265,Fuze,en,27.5319,6.45,111,96,45000000,2890908,David Mackenzie,2026-03-23,2026.0,3.0,Medium,Average,Released,Down to the wire.,An unexploded WWII bomb is discovered on a busy construction site in the centre of London. Chaos ensues as the military and police begin a mass evacuation against a ticking clock.,2020s
933260,The Substance,en,27.2774,7.133,6047,141,17500000,77316812,Coralie Fargeat,2024-09-07,2024.0,9.0,Medium,Good,Released,Have you ever dreamt of a better version of yourself?,"A fading celebrity decides to use a black market drug, a cell-replicating substance that temporarily creates a younger, better version of herself.",2020s
10138,Iron Man 2,en,27.1677,6.854,22411,124,200000000,623933331,Jon Favreau,2010-04-28,2010.0,4.0,Blockbuster,Average,Released,"It's not the armor that makes the hero, but the man inside.","With the world now aware of his dual life as the armored superhero Iron Man, billionaire inventor Tony Stark faces pressure from the government, the press and the public to share his technology with the military. Unwilling to let go of his invention, Stark, with Pepper Potts and James 'Rhodey' Rhodes at his side, must forge new alliances – and confront powerful enemies.",2010s
448772,A Great Love,it,27.1629,5.0,5,82,0,0,Ninì Grassia,1995-01-01,1995.0,1.0,Unknown,Average,Released,,Two couples meet at a spa when they realize their respective suites share a bathroom.,1990s
847742,Drishyam 3,ml,27.1141,7.0,5,157,21000000,0,Jeethu Joseph,2026-05-21,2026.0,5.0,Medium,Good,Released,The past never stays silent,"To protect his family and their dark secret, Georgekutty faces an organized new threat. As walls close in and cracks widen, how much more is he willing to sacrifice ?",2020s
6312,Brotherhood of the Wolf,fr,27.0673,6.741,1727,151,29000000,70800000,Christophe Gans,2001-01-31,2001.0,1.0,Medium,Average,Released,The year is 1766... The hunt for a killer has begun.,"In 18th century France, the Chevalier de Fronsac and his Native American friend Mani are sent by the King to the Gevaudan province to investigate the killings of hundreds by a mysterious beast.",2000s
675,Harry Potter and the Order of the Phoenix,en,26.8742,7.672,20821,138,150000000,938212738,David Yates,2007-07-08,2007.0,7.0,Blockbuster,Good,Released,The rebellion begins.,"When a new professor's methods leave Hogwarts unprepared to fight the rising tide of evil, Harry teaches students how to defend against the dark arts.",2000s
872585,Oppenheimer,en,26.8549,8.029,11831,181,100000000,952000000,Christopher Nolan,2023-07-19,2023.0,7.0,High,Excellent,Released,The world forever changes.,The story of J. Robert Oppenheimer's role in the development of the atomic bomb during World War II.,2020s
1218925,Chainsaw Man - The Movie: Reze Arc,ja,26.846,8.4,908,100,4100000,191400000,Tatsuya Yoshihara,2025-09-19,2025.0,9.0,Low,Excellent,Released,"Lost Love, Flower, Chainsaw.","In a brutal war between devils, hunters, and secret enemies, a mysterious girl named Reze has stepped into Denji's world, and he faces his deadliest battle yet, fueled by love in a world where survival knows no rules.",2020s
269955,Obsessed,ko,26.7263,6.7,82,132,0,0,Kim Dae-woo,2014-05-14,2014.0,5.0,Unknown,Average,Released,"If I cannot see you, I can't even breathe…","A secret, passionate affair happens in the summer of 1969 between Colonel Jin Pyeong, trapped in a loveless marriage with Soo Jin, and Jong Ga Heun, the Chinese-Korean wife of Captain Kyung Woo Jin.",2010s
1075175,How to Have Sex,en,26.6723,6.239,503,91,0,1216642,Molly Manning Walker,2023-11-02,2023.0,11.0,Unknown,Average,Released,,"Three British teenage girls go on a rites-of-passage holiday—drinking, clubbing and hooking up, in what should be the best summer of their lives.",2020s
10867,Malena,it,26.4876,7.49,2650,108,0,14493284,Giuseppe Tornatore,2000-10-27,2000.0,10.0,Unknown,Good,Released,"Too young to be a widow, too beautiful to be alone.","12-year-old Renato experiences three significant events on the same day: the beginning of the Second World War, getting a bike, and witnessing the arrival of the gorgeous Malèna. Through his eyes, we see the curse of beauty and loneliness of Malena, whose husband is presumed dead, and, through his soul, we see his love for her.",2000s
8587,The Lion King,en,26.4368,8.254,19715,89,45000000,763455561,Roger Allers,1994-06-15,1994.0,6.0,Medium,Excellent,Released,The greatest adventure of all is finding our place in the Circle of Life.,"Young lion prince Simba, eager to one day become king of the Pride Lands, grows up under the watchful eye of his father Mufasa; all the while his villainous uncle Scar conspires to take the throne for himself. Amid betrayal and tragedy, Simba must confront his past and find his rightful place in the Circle of Life.",1990s
1247165,Raja Shivaji,mr,26.3815,9.0,1,195,11000000,4600000,Riteish Deshmukh,2026-05-01,2026.0,5.0,Medium,Excellent,Released,,"Chronicles the rise of young Shivaji Bhonsale, who challenged the might of established empires to found the Maratha kingdom and lay the groundwork for 'Swarajya' (self-rule) during a turbulent period of Indian history.",2020s
324857,Spider-Man: Into the Spider-Verse,en,26.3208,8.393,17274,117,90000000,394884133,Bob Persichetti,2018-12-06,2018.0,12.0,High,Excellent,Released,Enter a universe where more than one wears the mask.,"Struggling to find his place in the world while juggling school and family, Brooklyn teenager Miles Morales is unexpectedly bitten by a radioactive spider and develops unfathomable powers just like the one and only Spider-Man. While wrestling with the implications of his new abilities, Miles discovers a super collider created by the madman Wilson ""Kingpin"" Fisk, causing others from across the Spider-Verse to be inadvertently transported to his dimension.",2010s
11,Star Wars,en,26.26,8.205,22373,121,11000000,775398007,George Lucas,1977-05-25,1977.0,5.0,Medium,Excellent,Released,"A long time ago in a galaxy far, far away...",Princess Leia is captured and held hostage by the evil Imperial forces in their effort to take over the galactic Empire. Venturesome Luke Skywalker and dashing captain Han Solo team together with the loveable robot duo R2-D2 and C-3PO to rescue the beautiful princess and restore peace and justice in the Empire.,1970s
315635,Spider-Man: Homecoming,en,26.1939,7.3,23196,133,175000000,880978185,Jon Watts,2017-07-05,2017.0,7.0,Blockbuster,Good,Released,Homework can wait. The city can't.,"Following the events of Captain America: Civil War, Peter Parker, with the help of his mentor Tony Stark, tries to balance his life as an ordinary high school student in Queens, New York City, with fighting crime as his superhero alter ego Spider-Man as a new threat, the Vulture, emerges.",2010s
557,Spider-Man,en,26.1502,7.331,20700,121,139000000,821708551,Sam Raimi,2002-05-01,2002.0,5.0,High,Good,Released,Go for the ultimate spin.,"After being bitten by a genetically altered spider at Oscorp, nerdy but endearing high school student Peter Parker is endowed with amazing powers to become the superhero known as Spider-Man.",2000s
796,Cruel Intentions,en,26.1143,6.816,3587,97,10500000,76347426,Roger Kumble,1999-03-05,1999.0,3.0,Medium,Average,Released,"In the game of seduction, there is only one rule: Never fall in love.","Slaking a thirst for dangerous games, Kathryn challenges her stepbrother, Sebastian, to deflower their headmaster's daughter before the summer ends. If he succeeds, the prize is the chance to bed Kathryn. But if he loses, Kathryn will claim his most prized possession.",1990s
424,Schindler's List,en,25.893,8.569,17501,195,22000000,321365567,Steven Spielberg,1993-12-15,1993.0,12.0,Medium,Excellent,Released,"Whoever saves one life, saves the world entire.",The true story of how businessman Oskar Schindler saved over a thousand Jewish lives from the Nazis while they worked as slaves in his factory during World War II.,1990s
807,Se7en,en,25.8768,8.4,23129,127,33000000,327311859,David Fincher,1995-09-22,1995.0,9.0,Medium,Excellent,Released,Gluttony. Greed. Sloth. Envy. Wrath. Pride. Lust.,"Two homicide detectives are on a desperate hunt for a serial killer whose crimes are based on the ""seven deadly sins"" in this dark and haunting film that takes viewers from the tortured remains of one victim to the next. The seasoned Det. Somerset researches each sin in an effort to get inside the killer's mind, while his novice partner, Mills, scoffs at his efforts to unravel the case.",1990s
7451,xXx,en,25.8675,5.989,4919,124,70000000,277448382,Rob Cohen,2002-08-09,2002.0,8.0,High,Average,Released,A new breed of secret agent.,"Xander Cage is your standard adrenaline junkie with no fear and a lousy attitude. When the US Government ""recruits"" him to go on a mission, he's not exactly thrilled. His mission: to gather information on an organization that may just be planning the destruction of the world, led by the nihilistic Yorgi.",2000s
767,Harry Potter and the Half-Blood Prince,en,25.8399,7.68,20807,153,250000000,933959197,David Yates,2009-07-15,2009.0,7.0,Blockbuster,Good,Released,Dark secrets revealed.,Dumbledore tries to prepare Harry for the final battle with Voldemort while Death Eaters wreak havoc in both Muggle and Wizard worlds.,2000s
950396,The Gorge,en,25.836,7.645,3768,128,70000000,0,Scott Derrickson,2025-02-13,2025.0,2.0,High,Good,Released,The world's most dangerous secret lies between them.,"Two highly trained operatives grow close from a distance after being sent to guard opposite sides of a mysterious gorge. When an evil below emerges, they must work together to survive what lies within.",2020s
1646787,Sundutan,tl,25.5308,4.0,1,70,0,0,Rodante Pajemna Jr.,2026-03-06,2026.0,3.0,Unknown,Poor,Released,,"A hole on the wall accidentally connects two women emotionally and physically. Forbidden love, greed, betrayal... what lies beyond the hole? And for how long can they keep covering it up?",2020s
438631,Dune,en,25.4351,7.78,14938,155,165000000,410668500,Denis Villeneuve,2021-09-15,2021.0,9.0,Blockbuster,Good,Released,It begins.,"Paul Atreides, a brilliant and gifted young man born into a great destiny beyond his understanding, must travel to the most dangerous planet in the universe to ensure the future of his family and his people. As malevolent forces explode into conflict over the planet's exclusive supply of the most precious resource in existence-a commodity capable of unlocking humanity's greatest potential-only those who can conquer their fear will survive.",2020s
1241982,Moana 2,en,25.3592,7.005,3090,100,150000000,1059242164,David G. Derrick Jr.,2024-11-21,2024.0,11.0,Blockbuster,Good,Released,The ocean is calling them back.,"After receiving an unexpected call from her wayfinding ancestors, Moana journeys alongside Maui and a new crew to the far seas of Oceania and into dangerous, long-lost waters for an adventure unlike anything she's ever faced.",2020s
1368314,Passenger,en,25.3502,6.2,66,94,15000000,29814244,André Øvredal,2026-05-20,2026.0,5.0,Medium,Average,Released,"130 million people take road trips every year. 15,400 of them are never seen again.","After a young couple witnesses a gruesome highway accident, they soon realize they did not leave the crash scene alone, as a demonic presence called the Passenger that won't stop until it claims them both turns their van life adventure into a nightmare.",2020s
680493,Return to Silent Hill,en,25.1504,5.4,602,106,23000000,47976996,Christophe Gans,2026-01-21,2026.0,1.0,Medium,Average,Released,Guilt is a place you can never leave.,"When James receives a mysterious letter from his lost love Mary, he is drawn to Silent Hill—a once-familiar town now consumed by darkness. As he searches for her, James faces monstrous creatures and unravels a terrifying truth that will push him to the edge of his sanity.",2020s
