movie_id,title,original_language,popularity,vote_average,vote_count,runtime,budget,revenue,director,release_date,release_year,release_month,budget_category,rating_category,status,tagline,overview,decade
1598785,Milky☆Subway: The Galactic Limited Express - the Movie,ja,41.8226,9.353,17,46,0,0,Yohei Kameyama,2026-02-06,2026.0,2.0,Unknown,Excellent,Released,,"Six delinquents are tasked with cleaning a train as part of a community service program. But when the train suddenly takes off, chaos ensues.",2020s
671,Harry Potter and the Philosopher's Stone,en,41.8109,7.899,29619,152,125000000,976475550,Chris Columbus,2001-11-16,2001.0,11.0,High,Good,Released,Let the magic begin.,"Harry Potter has lived under the stairs at his aunt and uncle's house his whole life. But on his 11th birthday, he learns he's a powerful wizard—with a place waiting for him at the Hogwarts School of Witchcraft and Wizardry. As he learns to harness his newfound powers with the help of the school's kindly headmaster, Harry uncovers the truth about his parents' deaths—and about the villain who's to blame.",2000s
1375646,Colony,ko,41.3784,6.853,51,123,12000000,0,Yeon Sang-ho,2026-05-21,2026.0,5.0,Medium,Average,Released,,"Professor Se-jeong is thrust into a bloody nightmare when a rapidly mutating virus is released during a biotech conference causing authorities to seal the facility. Trapped inside with no escape, Se-jeong along with a small group of survivors must fight to stay alive while the infected undergo horrific transformations.",2020s
1171145,Crime 101,en,41.2463,6.992,1057,141,90000000,72900246,Bart Layton,2026-02-11,2026.0,2.0,High,Average,Released,Always have an exit.,"When an elusive thief whose high-stakes heists unfold along the iconic 101 freeway in Los Angeles eyes the score of a lifetime, with hopes of this being his final job, his path collides with a disillusioned insurance broker who is facing her own crossroads. Determined to crack the case, a relentless detective closes in on the operation, raising the stakes even higher.",2020s
1426822,Mortal Game,en,40.485,4.917,12,85,0,0,John Lechago,2025-02-03,2025.0,2.0,Unknown,Poor,Released,,"A group of hunters travel to a mysterious island to track down a legendary forest creature. They soon realize their guide has set them up as bait, forcing them to confront a highly intelligent predator that terrorizes them one by one.",2020s
634649,Spider-Man: No Way Home,en,40.1948,7.9,22045,148,200000000,2019206586,Jon Watts,2021-12-15,2021.0,12.0,Blockbuster,Good,Released,The Multiverse unleashed.,"Peter Parker is unmasked and no longer able to separate his normal life from the high-stakes of being a super-hero. When he asks for help from Doctor Strange the stakes become even more dangerous, forcing him to discover what it truly means to be Spider-Man.",2020s
1368881,Ladies First,en,40.1901,5.972,308,94,0,0,Thea Sharrock,2026-05-21,2026.0,5.0,Unknown,Average,Released,,"An arrogant but charismatic ladies' man finds his life of money, power and casual flings upended when he wakes up in a parallel world dominated by women.",2020s
911430,F1,en,40.0191,7.8,4047,156,250000000,631627111,Joseph Kosinski,2025-06-25,2025.0,6.0,Blockbuster,Good,Released,Let's ride.,Racing legend Sonny Hayes is coaxed out of retirement to lead a struggling Formula 1 team—and mentor a young hotshot driver—while chasing one more chance at glory.,2020s
155,The Dark Knight,en,39.7514,8.531,35869,152,185000000,1004558444,Christopher Nolan,2008-07-16,2008.0,7.0,Blockbuster,Excellent,Released,Welcome to a world without rules.,"Batman raises the stakes in his war on crime. With the help of Lt. Jim Gordon and District Attorney Harvey Dent, Batman sets out to dismantle the remaining criminal organizations that plague the streets. The partnership proves to be effective, but they soon find themselves prey to a reign of chaos unleashed by a rising criminal mastermind known to the terrified citizens of Gotham as the Joker.",2000s
1368337,The Odyssey,en,39.5644,0.0,0,172,250000000,0,Christopher Nolan,2026-07-15,2026.0,7.0,Blockbuster,Poor,Post Production,Defy the gods.,"Odysseus, the legendary King of Ithaca, embarks on a long and perilous journey home following the Trojan War. Throughout his voyage, he is forced to confront the whims of gods, mythological monsters, and trials that stretch both his cunning and his humanity to the breaking point.",2020s
120,The Lord of the Rings: The Fellowship of the Ring,en,38.9945,8.434,27632,179,93000000,871368364,Peter Jackson,2001-12-18,2001.0,12.0,High,Excellent,Released,One ring to rule them all.,"Young hobbit Frodo Baggins, after inheriting a mysterious ring from his uncle Bilbo, must leave his home in order to keep it from falling into the hands of its evil creator. Along the way, a fellowship is formed to protect the ringbearer and make sure that the ring arrives at its final destination: Mt. Doom, the only place where it can be destroyed.",2000s
803796,KPop Demon Hunters,en,38.7946,8.024,2862,96,100000000,24619953,Maggie Kang,2025-06-20,2025.0,6.0,High,Excellent,Released,They sing. They dance. They battle demons.,"When K-pop superstars Rumi, Mira and Zoey aren't selling out stadiums, they're using their secret powers to protect their fans from supernatural threats.",2020s
1252051,Disforia,es,38.69,4.556,9,82,0,0,Christopher Cartagena,2025-09-20,2025.0,9.0,Unknown,Poor,Released,DEATH WILL COME BY THOSE WHO LOVE YOU,"Set in the near future against the backdrop of widespread looting and societal collapse, the couple formed by Esther and Tomás and their daughter Say move to their summer house so they can promptly sell it and then flee from their country to France, drawing attention from a ring of voyeurs of real-life torture streamed on the dark web.",2020s
1292695,They Will Kill You,en,38.4766,7.0,692,95,20000000,19382152,Kirill Sokolov,2026-03-25,2026.0,3.0,Medium,Good,Released,Let them try.,"A woman answers a help wanted ad to be a housekeeper in a mysterious New York City high-rise, unaware that she is entering a community that has seen a number of disappearances over the years and may be under the grip of a Satanic cult.",2020s
1135873,GGS - Ganteng-Ganteng Sange,hi,38.4545,6.1,7,28,0,0,,2023-05-28,2023.0,5.0,Unknown,Average,Released,,Kelas Bintang is back with this pack of drama called GGS - Ganteng-Ganteng Sange.,2020s
1556616,Summer House,tr,38.3608,8.2,2,0,0,0,Erdem Tepegöz,2026-06-06,2026.0,6.0,Unknown,Excellent,Released,,"Selin travels back in time at a summer house and finds herself in her mother's youth, changing her family's fate and rebuilding her own life.",2020s
1038392,The Conjuring: Last Rites,en,38.3224,6.926,1869,136,55000000,499256445,Michael Chaves,2025-09-03,2025.0,9.0,High,Average,Released,The case that ended it all.,Paranormal investigators Ed and Lorraine Warren take on one last terrifying case involving mysterious entities they must confront.,2020s
1316427,7 Dogs,ar,38.0221,5.5,4,123,40000000,0,Adil El Arbi,2026-05-27,2026.0,5.0,Medium,Average,Released,Not all dogs stay loyal.,Interpol agent Khalid Al-Azzazi joins forces with Ghali Abu Dawood from the 7 Dogs crime syndicate to fight drug trafficking.,2020s
1599191,仙逆剧场版 弑仙之战,zh,37.9652,0.0,0,0,0,0,,,,,Unknown,Poor,Released,,,
862,Toy Story,en,37.5393,7.976,19927,81,30000000,401157969,John Lasseter,1995-11-22,1995.0,11.0,Medium,Good,Released,The adventure takes off when toys come to life!,"Led by Woody, Andy's toys live happily in his room until Andy's birthday brings Buzz Lightyear onto the scene. Afraid of losing his place in Andy's heart, Woody plots against Buzz. But when circumstances separate Buzz and Woody from their owner, the duo eventually learns to put aside their differences.",1990s
4257,Scary Movie 4,en,36.8467,5.49,3601,83,40000000,178710620,David Zucker,2006-04-12,2006.0,4.0,Medium,Average,Released,Bury the grudge. Burn the village. See the saw.,"Cindy finds out the house she lives in is haunted by a little boy and goes on a quest to find out who killed him and why. Also, Alien ""Tr-iPods"" are invading the world and she has to uncover the secret in order to stop them.",2000s
4232,Scream,en,36.0386,7.43,7982,112,14000000,173046663,Wes Craven,1996-12-20,1996.0,12.0,Medium,Good,Released,Someone has taken their love of scary movies one step too far. Solving this mystery is going to be murder.,"A year after the murder of her mother, a teenage girl is terrorized by a masked killer who targets her and her friends by using scary movies as part of a deadly game.",1990s
1156594,Our Fault,es,35.6832,7.364,678,110,0,0,Domingo González,2025-10-15,2025.0,10.0,Unknown,Good,Released,,"Jenna and Lion's wedding brings about the long-awaited reunion between Noah and Nick after their breakup. Nick's inability to forgive Noah stands as an insurmountable barrier. He, heir to his grandfather's businesses, and she, starting her professional life, resist fueling a flame that's still alive. But now that their paths have crossed again, will love be stronger than resentment?",2020s
1184918,The Wild Robot,en,35.6651,8.314,6129,102,78000000,331982078,Chris Sanders,2024-09-12,2024.0,9.0,High,Excellent,Released,Discover your true nature.,"After a shipwreck, an intelligent robot called Roz is stranded on an uninhabited island. To survive the harsh environment, Roz bonds with the island's animals and cares for an orphaned baby goose.",2020s
1233413,Sinners,en,35.4278,7.5,4614,138,90000000,370333701,Ryan Coogler,2025-04-16,2025.0,4.0,High,Good,Released,Dance with the devil.,"Trying to leave their troubled lives behind, twin brothers return to their hometown to start again, only to discover that an even greater evil is waiting to welcome them back.",2020s
27,9 Songs,en,35.2866,5.552,581,70,1000000,1574623,Michael Winterbottom,2004-07-16,2004.0,7.0,Low,Average,Released,"2 lovers, one summer, and the 9 songs that defined them.","Matt, a young glaciologist, soars across the vast, silent, icebound immensities of the South Pole as he recalls his love affair with Lisa. They meet at a mobbed rock concert in a vast music hall - London's Brixton Academy. They are in bed at night's end. Together, over a period of several months, they pursue a mutual sexual passion whose inevitable stages unfold in counterpoint to nine live-concert songs.",2000s
1266990,Kulong,tl,35.2732,6.417,18,48,0,0,Sigrid Polon,2024-05-24,2024.0,5.0,Unknown,Average,Released,,"Three friends retreat to a resort to collaborate on a daring screenplay for a contest. Faced with the challenge of writing about passion despite their own dry spells, their journey soon blurs the line between imagination and experience.",2020s
64641,Monika,it,35.1938,4.7,20,93,0,0,Mario Imperoli,1974-02-28,1974.0,2.0,Unknown,Poor,Released,,"Monika is young, beautiful and a virgin. She is only 16 years old, and, beside getting the attention of all her classmates, she also attracts older men. She has a relationship with a boy, Leo, but she doesn't know that he uses to pimp the girls he seduces to rich businessmen. One of Leo's client befriends Monika and becomes so obsessed that he pays Leo to get her. But Monika turns her attention to her art professor, unknowing that he too has his secrets.",1970s
1196067,Worldbreaker,en,35.0763,6.037,205,95,0,0,Brad Anderson,2025-10-30,2025.0,10.0,Unknown,Average,Released,The future belongs to those who fight.,"Five years ago, a tear in the fabric of reality brought creatures to our world from an alternate dimension bent on our destruction. A father hides his daughter on an island to keep her safe while he prepares her for survival and the battles to come. But when the world is about to break, no place is safe.",2020s
13078,The Babysitters,en,34.805,6.002,543,88,0,44852,David Ross,2008-05-09,2008.0,5.0,Unknown,Average,Released,These girls mean business.,"Seventeen-year-old Shirley is a good student who works as a babysitter in order to make money for college. One night Michael, a father Shirley works for, confesses he's unhappy with married life. Shirley has a crush on Michael, and seizes this moment to kiss him. Michael is so happy he presents Shirley with a big tip, which gives her an idea. Shirley plans to make extra money by setting up her teenage friends with other unhappy fathers.",2000s
673,Harry Potter and the Prisoner of Azkaban,en,34.6698,8.0,23185,141,130000000,789804554,Alfonso Cuarón,2004-05-31,2004.0,5.0,High,Excellent,Released,Something wicked this way comes.,Harry Potter's life is in danger once more as dangerous wizard Sirius Black has escaped from Azkaban Prison and is heading to Hogwarts.,2000s
14836,Coraline,en,34.6653,7.9,9006,100,60000000,185860104,Henry Selick,2009-02-05,2009.0,2.0,High,Good,Released,Be careful what you wish for.,"Wandering her rambling old house in her boring new town, 11-year-old Coraline discovers a hidden door to a strangely idealized version of her life. In order to stay in the fantasy, she must make a frighteningly real sacrifice.",2000s
597,Titanic,en,34.469,7.903,27203,194,200000000,2264162353,James Cameron,1997-12-18,1997.0,12.0,Blockbuster,Good,Released,Nothing on earth could come between them.,"101-year-old Rose DeWitt Bukater tells the story of her life aboard the Titanic, 84 years later. A young Rose boards the ship with her mother and fiancé. Meanwhile, Jack Dawson and Fabrizio De Rossi win third-class tickets aboard the ship. Rose tells the whole story from Titanic's departure through to its death—on its first and last voyage—on April 15, 1912.",1990s
1301421,The Sheep Detectives,en,34.3959,7.669,157,109,75000000,105516293,Kyle Balda,2026-04-30,2026.0,4.0,High,Good,Released,A new breed of mystery.,"George Hardy is a shepherd who reads detective novels to his beloved sheep every night, assuming they can't possibly understand. But when a mysterious incident disrupts life on the farm, the sheep realize they must become the detectives. As they follow the clues and investigate human suspects, they prove that even sheep can be brilliant crime-solvers.",2020s
27205,Inception,en,34.3413,8.372,39334,148,160000000,839030630,Christopher Nolan,2010-07-15,2010.0,7.0,Blockbuster,Excellent,Released,Your mind is the scene of the crime.,"Cobb, a skilled thief who commits corporate espionage by infiltrating the subconscious of his targets is offered a chance to regain his old life as payment for a task considered to be impossible: ""inception"", the implantation of another person's idea into a target's subconscious.",2010s
1168190,The Wrecking Crew,en,34.2026,6.982,1055,125,78500000,89000000,Ángel Manuel Soto,2026-01-28,2026.0,1.0,High,Average,Released,They fight like brothers. They wreck like legends.,"Estranged half-brothers Jonny and James reunite after their father's mysterious death. As they search for the truth, buried secrets reveal a conspiracy threatening to tear their family apart.",2020s
496243,Parasite,ko,34.1523,8.494,20701,133,11363000,257591776,Bong Joon Ho,2019-05-30,2019.0,5.0,Medium,Excellent,Released,Act like you own the place.,"All unemployed, Ki-taek's family takes peculiar interest in the wealthy and glamorous Parks for their livelihood until they get entangled in an unexpected incident.",2010s
674,Harry Potter and the Goblet of Fire,en,34.0114,7.803,22194,157,150000000,895921036,Mike Newell,2005-11-16,2005.0,11.0,Blockbuster,Good,Released,Dark and difficult times lie ahead.,"When his name emerges from the Goblet of Fire, Harry Potter becomes a competitor in a grueling battle for glory among three wizarding schools. Signs of Voldemort's return emerge as Harry's friends help him prepare for the Triwizard Tournament.",2000s
129,Spirited Away,ja,33.8703,8.535,18386,125,19000000,274925095,Hayao Miyazaki,2001-07-20,2001.0,7.0,Medium,Excellent,Released,Beyond the tunnel was a mysterious town.,"A young girl, Chihiro, becomes trapped in a strange new world of spirits. When her parents undergo a mysterious transformation, she must call upon the courage she never knew she had to free her family.",2000s
672,Harry Potter and the Chamber of Secrets,en,33.6186,7.704,23610,161,100000000,876688482,Chris Columbus,2002-11-13,2002.0,11.0,High,Good,Released,Something evil has returned to Hogwarts!,"Cars fly, trees fight back, and a mysterious house-elf comes to warn Harry Potter at the start of his second year at Hogwarts. Adventure and danger await when bloody writing on a wall announces: The Chamber Of Secrets Has Been Opened. To save Hogwarts will require all of Harry, Ron and Hermione's magical abilities and courage.",2000s
1287454,The Farmer's Bride Requires Care! Part 2: The Organic Grand Strategy,ja,33.5025,10.0,1,72,0,0,Shinji Imaoka,2021-04-02,2021.0,4.0,Unknown,Excellent,Released,,"Rumi, now accustomed to life on the farm, remains frustrated with her husband's continued lack of interest in their nighttime intimacy. One day, she begins to suspect that her husband might be falling for a dubious organic farming investment scheme. Following him, Rumi discovers the presence of an unusually seductive woman, but...",2020s
62029,Bingo Bongo,it,33.4847,5.7,176,102,0,0,Pasquale Festa Campanile,1982-12-23,1982.0,12.0,Unknown,Average,Released,,"The ape-man, found somewhere in the jungles of Congo, transferred to Milan and named Bingo Bongo. The only one who believes in the human qualities of him is Laura, a woman anthropologist , so their affection for each other even grows to love.",1980s
1234731,Anaconda,en,33.2355,5.9,1210,100,45000000,135148320,Tom Gormican,2025-12-24,2025.0,12.0,Medium,Average,Released,A comedy so big it'll leave you breathless.,"A group of friends facing mid-life crises head to the rainforest with the intention of remaking their favorite movie from their youth, only to find themselves in a fight for their lives against natural disasters, giant snakes and violent criminals.",2020s
979,Irreversible,fr,33.2056,7.184,3300,93,3500000,6500000,Gaspar Noé,2002-05-22,2002.0,5.0,Low,Good,Released,Time destroys everything.,A woman’s lover and her ex-boyfriend take justice into their own hands after she becomes the victim of a rapist. Because some acts can’t be undone. Because man is an animal. Because the desire for vengeance is a natural impulse. Because most crimes remain unpunished.,2000s
300496,Nefeli,el,33.1212,3.6,7,110,10000000,0,Omiros Efstratiadis,1980-01-01,1980.0,1.0,Medium,Poor,Released,Nefeli and her two best friends invite you in a world of sensualism.,"A beautiful woman is going to the island of Lesbos to rest, there she will meet two other beautiful young women and it will be great having sex with everyone.",1980s
502356,The Super Mario Bros. Movie,en,33.1097,7.604,10789,93,100000000,1360879735,Aaron Horvath,2023-04-05,2023.0,4.0,High,Good,Released,Not all heroes wear capes. Some wear overalls.,"While working underground to fix a water main, Brooklyn plumbers—and brothers—Mario and Luigi are transported down a mysterious pipe and wander into a magical new world. But when the brothers are separated, Mario embarks on an epic quest to find Luigi.",2020s
4256,Scary Movie 3,en,33.0762,5.972,4503,84,45000000,220673217,David Zucker,2003-10-24,2003.0,10.0,Medium,Average,Released,Great trilogies come in threes.,"In the third installment of the Scary Movie franchise, news anchorwoman Cindy Campbell has to investigate mysterious crop circles and killing video tapes, and help the President stop an alien invasion in the process.",2000s
969681,Spider-Man: Brand New Day,en,32.8099,0.0,0,0,0,0,Destin Daniel Cretton,2026-07-29,2026.0,7.0,Unknown,Poor,Post Production,A brand new day starts now.,"Four years have passed since the events of No Way Home, and Peter is now an adult living entirely alone, having voluntarily erased himself from the lives and memories of those he loves. Crime-fighting in a New York that no longer knows his name, he's devoted himself entirely to protecting his city — a full-time Spider-Man — but as the demands on him intensify, the pressure sparks a surprising physical evolution that threatens his existence, even as a strange new pattern of crimes gives rise to one of the most powerful threats he has ever faced.",2020s
1234821,Jurassic World Rebirth,en,32.6689,6.3,3398,134,180000000,869146189,Gareth Edwards,2025-06-23,2025.0,6.0,Blockbuster,Average,Released,A new era is born.,"Five years after the events of Jurassic World Dominion, covert operations expert Zora Bennett is contracted to lead a skilled team on a top-secret mission to secure genetic material from the world's three most massive dinosaurs. When Zora's operation intersects with a civilian family whose boating expedition was capsized, they all find themselves stranded on an island where they come face-to-face with a sinister, shocking discovery that's been hidden from the world for decades.",2020s
137051,Midnight Matinee,en,32.5326,5.4,7,91,0,0,Richard Martin,1988-10-12,1988.0,10.0,Unknown,Average,Released,Every mystery has its clues,"Even though a devastating murder took place during a small town's horror film festival two years earlier, townspeople want another festival.",1980s
680,Pulp Fiction,en,32.4575,8.483,30260,154,8000000,213928762,Quentin Tarantino,1994-09-10,1994.0,9.0,Low,Excellent,Released,You won’t know the facts until you’ve seen the fiction.,"A burger-loving hit man, his philosophical partner, a drug-addled gangster's moll and a washed-up boxer converge in this sprawling, comedic crime caper. Their adventures unfurl in three stories that ingeniously trip back and forth in time.",1990s
1639398,Mexican Psycho,es,32.0679,7.42,88,99,0,0,J. Xavier Velasco,2026-03-19,2026.0,3.0,Unknown,Good,Released,,"Follows an ""ultra-violent and intelligent"" psychopath who challenges the police by leaving a white paper rabbit at each crime scene, connecting them all.",2020s
299534,Avengers: Endgame,en,31.8766,8.237,27805,181,356000000,2799439100,Anthony Russo,2019-04-24,2019.0,4.0,Blockbuster,Excellent,Released,Avenge the fallen.,"After the devastating events of Avengers: Infinity War, the universe is in ruins due to the efforts of the Mad Titan, Thanos. With the help of remaining allies, the Avengers must assemble once more in order to undo Thanos' actions and restore order to the universe once and for all, no matter what consequences may be in store.",2010s
13192,Moonwalker,en,24.9637,7.082,657,93,22000000,67000000,Colin Chilvers,1988-10-29,1988.0,10.0,Medium,Good,Released,A movie like no other.,This fantastical movie inspired by the music of Michael Jackson features imaginative interpretations of hit tracks from the iconic 1987 album “Bad”.,1980s
1414413,Brothers Under Fire,en,31.4769,5.911,28,99,0,0,Justin Chadwick,2026-04-15,2026.0,4.0,Unknown,Average,Released,He never planned to fight. But he refuses to fall.,"Captain Jordan Wright's squadron on leave for a wedding in Mexico encounters a murderous cartel. As Jordan tries to lead survivors to safety, war erupts between his squad and the cartel, forcing him into a battle to save his men.",2020s
1081003,Supergirl,en,31.4108,0.0,0,108,175000000,0,Craig Gillespie,2026-06-23,2026.0,6.0,Blockbuster,Poor,Post Production,Truth. Justice. Whatever.,"When an unexpected and ruthless adversary strikes too close to home, Kara Zor-El, aka Supergirl, reluctantly joins forces with an unlikely companion on an epic, interstellar journey of vengeance and justice.",2020s
1510769,29,ta,30.838,7.4,5,149,0,0,Rathna Kumar,2026-05-08,2026.0,5.0,Unknown,Good,Released,,"A quirky 29-year-old named Sathya embarks on an unexpected journey of laughter, unlikely friendships, and self-discovery. Through hilarious misadventures and chance encounters, he slowly sees life's bigger picture - its surprises, joys, and second chances.",2020s
264980,Loves of a French Pussycat,de,30.8034,4.5,8,94,0,0,Hans Billian,1972-03-09,1972.0,3.0,Unknown,Poor,Released,The sweetest French Pastry since Pussy Galore!,"Rolf, a sex-advice columnist and a lecher, has affairs with numerous women, but never a permanent relationship. Suzanne, one of his ex-lovers, offers to bet that no woman can get Rolf to propose marriage, a bet her girlfriend Andrea eagerly accepts. But there's a catch: To win the bet, Andrea must get the womanizing Rolf to commit to marriage without first going to bed with him.",1970s
240,The Godfather Part II,en,30.6544,8.572,13954,202,13000000,102600000,Francis Ford Coppola,1974-12-20,1974.0,12.0,Medium,Excellent,Released,The rise and fall of the Corleone empire.,"In the continuing saga of the Corleone crime family, a young Vito Corleone grows up in Sicily and in 1910s New York. In the 1950s, Michael Corleone attempts to expand the family business into Las Vegas, Hollywood and Cuba.",1970s
1539104,JUJUTSU KAISEN: Execution,ja,30.4674,6.0,99,88,0,44457030,Shota Goshozono,2025-11-07,2025.0,11.0,Unknown,Average,Released,,"A veil abruptly descends over the busy Shibuya area amid the bustling Halloween crowds, trapping countless civilians inside. Satoru Gojo, the strongest jujutsu sorcerer, steps into the chaos. But lying in wait are curse users and spirits scheming to seal him away. Yuji Itadori, accompanied by his classmates and other top-tier jujutsu sorcerers, enters the fray in an unprecedented clash of curses — the Shibuya Incident. In the aftermath, ten colonies across Japan are transformed into dens of curses in a plan orchestrated by Noritoshi Kamo. As the deadly Culling Game starts, Special Grade sorcerer Yuta Okkotsu is assigned to carry out Yuji's execution for his perceived crimes. A compilation movie of Shibuya Incident including the first two episodes of the Culling Games arc.",2020s
1272837,28 Years Later: The Bone Temple,en,30.2903,7.132,1280,109,63000000,58522222,Nia DaCosta,2026-01-14,2026.0,1.0,High,Good,Released,Fear is the new faith.,Dr. Kelson finds himself in a shocking new relationship - with consequences that could change the world as they know it - and Spike's encounter with Jimmy Crystal becomes a nightmare he can't escape.,2020s
