adult,backdrop_path,genre_ids,id,title,original_language,original_title,overview,popularity,poster_path,release_date,softcore,video,vote_average,vote_count,runtime,budget,revenue,status,tagline,director
False,/7I6VUdPj6tQECNHdviJkUHD2u89.jpg,"28,53,80",603692,John Wick: Chapter 4,en,John Wick: Chapter 4,"With the price on his head ever increasing, John Wick uncovers a path to defeating The High Table. But before he can earn his freedom, Wick must face off against a new enemy with powerful alliances across the globe and forces that turn old friends into foes.",21.9893,/vZloFAK7NmvMGKE7VkF5UHaz0I.jpg,2023-03-21,False,False,7.706,7933,,,,,,
False,/4XM8DUTQb3lhLemJC51Jx4a2EuA.jpg,"28,80,53",385687,Fast X,en,Fast X,"Over many missions and against impossible odds, Dom Toretto and his family have outsmarted, out-nerved and outdriven every foe in their path. Now, they confront the most lethal opponent they've ever faced: A terrifying threat emerging from the shadows of the past who's fueled by blood revenge, and who is determined to shatter this family and destroy everything—and everyone—that Dom loves, forever.",21.9599,/fiVW06jE7z9YnO4trhaMEdclSiC.jpg,2023-05-17,False,False,7.0,6325,,,,,,
False,/pMxO1beNNFYMDM7RcDyKW5Wheuz.jpg,"12,16,35,10751,14",991494,The SpongeBob Movie: Search for SquarePants,en,The SpongeBob Movie: Search for SquarePants,"Desperate to be a big guy, SpongeBob sets out to prove his bravery to Mr. Krabs by following The Flying Dutchman – a mysterious swashbuckling ghost pirate – on a seafaring adventure that takes him to the deepest depths of the deep sea, where no Sponge has gone before.",21.9125,/xJnOMMsFASxNiFnG7v3TNIQ3ife.jpg,2025-12-16,False,False,6.848,296,,,,,,
False,/1yktYsxkmUtUFTUnCAUaqG6FEiz.jpg,"28,53,80",541671,Ballerina,en,Ballerina,"Taking place during the events of John Wick: Chapter 3 – Parabellum, Eve Macarro begins her training in the assassin traditions of the Ruska Roma.",21.9059,/2VUmvqsHb6cEtdfscEA6fqqVzLg.jpg,2025-06-04,False,False,7.243,2621,,,,,,
False,/s94NjfKkcSczZ1FembwmQZwsuwY.jpg,"878,12,28",617126,The Fantastic 4: First Steps,en,The Fantastic 4: First Steps,"Against the vibrant backdrop of a 1960s-inspired, retro-futuristic world, Marvel's First Family is forced to balance their roles as heroes with the strength of their family bond, while defending Earth from a ravenous space god called Galactus and his enigmatic Herald, Silver Surfer.",21.9034,/abqOz6EL3yXyOOafCPZxjL1M5bQ.jpg,2025-07-23,False,False,6.963,3367,,,,,,
False,/31VpBgUX5O4Z3dn5ZbX8HLqoXH3.jpg,"28,27,878,53",72190,World War Z,en,World War Z,"Life for former United Nations investigator Gerry Lane and his family seems content. Suddenly, the world is plagued by a mysterious infection turning whole human populations into rampaging mindless zombies. After barely escaping the chaos, Lane is persuaded to go on a mission to investigate this disease. What follows is a perilous trek around the world where Lane must brave horrific dangers and long odds to find answers before human civilization falls.",21.8957,/aCnVdvExw6UWSeQfr0tUH3jr4qG.jpg,2013-06-19,False,False,6.834,16576,,,,,,
False,/vadUKKQixxOKWkcuZ1SUEoBQeVG.jpg,18,10867,Malena,it,Malèna,"12-year-old Renato experiences three significant events on the same day: the beginning of the Second World War, getting a bike, and witnessing the arrival of the gorgeous Malèna. Through his eyes, we see the curse of beauty and loneliness of Malena, whose husband is presumed dead, and, through his soul, we see his love for her.",21.8775,/3OyQTl0IGkbnjDxd3MhztfPE34g.jpg,2000-10-27,False,False,7.485,2632,,,,,,
False,/vcrgU0KaNj5mKUCIQSUdiQwTE9y.jpg,"12,14",12444,Harry Potter and the Deathly Hallows: Part 1,en,Harry Potter and the Deathly Hallows: Part 1,"Harry, Ron and Hermione walk away from their last year at Hogwarts to find and destroy the remaining Horcruxes, putting an end to Voldemort's bid for immortality. But with Harry's beloved Dumbledore dead and Voldemort's unscrupulous Death Eaters on the loose, the world is more dangerous than ever.",21.7598,/iGoXIpQb7Pot00EEdwpwPajheZ5.jpg,2010-11-17,False,False,7.735,20382,,,,,,
False,/eJ0HooOOD1uzI39CfOQNWIiWKlJ.jpg,"28,18,53",1387382,Hunting Season,en,Hunting Season,"When a reclusive survivalist and his daughter rescue a mysterious, wounded woman from a river, they become entangled in a deadly web of violence and revenge, forcing them to confront a brutal criminal to survive.",21.7218,/cbryTyaWdqrKpQCw6K7zm2jrB5v.jpg,2025-12-05,False,False,6.905,226,,,,,,
False,/bf5TG9RODkPXmtJSgf8Iymof1wl.jpg,"36,18",1214931,Nuremberg,en,Nuremberg,"In postwar Germany, an American psychiatrist must determine whether Nazi prisoners are fit to go on trial for war crimes, and finds himself in a complex battle of intellect and ethics with Hermann Göring, Hitler's right-hand man.",21.5311,/xthXNYltOOm80vW5Kxjzxx5gvQ6.jpg,2025-11-06,False,False,7.547,1060,,,,,,
False,/xOMo8BRK7PfcJv9JCnx7s5hj0PX.jpg,"878,12",693134,Dune: Part Two,en,Dune: Part Two,"Follow the mythic journey of Paul Atreides as he unites with Chani and the Fremen while on a path of revenge against the conspirators who destroyed his family. Facing a choice between the love of his life and the fate of the known universe, Paul endeavors to prevent a terrible future only he can foresee.",21.4557,/1pdfLvkbY9ohJlCjQH2CZjjYVvJ.jpg,2024-02-27,False,False,8.127,7987,,,,,,
False,/mqAuLsN6oOme6lSKoTb6yyP4U8E.jpg,"10402,99",13576,This Is It,en,This Is It,"A compilation of interviews, rehearsals and backstage footage of Michael Jackson as he prepared for his series of sold-out shows in London.",21.4504,/8GvQzHFSqr9KhyVxLEpB5dXPOWG.jpg,2009-10-28,False,False,7.333,1054,,,,,,
False,/lsFLh0tcvafTom7lADYg4EGtDlY.jpg,"16,28,12",1599189,剑来院线剧场版 十三之争,zh,剑来院线剧场版 十三之争,,21.4094,/95OnjUQ1mlu7JHvIMcjYL6ah9Ah.jpg,2026-05-01,False,False,0.0,0,,,,,,
False,/6U1ASeNWCTxIPeRFHXMBHp3JBfR.jpg,53,233651,Sex Rider: Wet Highway,ja,セックス・ライダー　濡れたハイウェイ,"On the eve of her wedding and while cheating with another man, a woman gets involved into a dangerous new world of experiences.",21.3278,/jmyo0j2HMDeFvMh5y1wFYpoxH6S.jpg,1971-12-29,False,False,4.923,13,,,,,,
False,/nv5wwZou159v5OC61i4ElR7OqyY.jpg,"14,16,12",4935,Howl's Moving Castle,ja,ハウルの動く城,"Sophie, a young milliner, is turned into an elderly woman by a witch who enters her shop and curses her. She encounters a wizard named Howl and gets caught up in his resistance to fighting for the king.",21.2917,/13kOl2v0nD2OLbVSHnHk8GUFEhO.jpg,2004-09-09,False,False,8.388,11088,,,,,,
False,/mZ6J2g6HCV2gj3iuCdSxcyBXq9c.jpg,"16,18,10751,36",1167307,David,en,David,"From the songs of his mother’s heart to the whispers of a faithful God, David’s story begins in quiet devotion. When the giant Goliath rises to terrorize a nation, a young shepherd armed with only a sling, a few stones, and unshakable faith steps forward. Pursued by power and driven by purpose, his journey tests the limits of loyalty, love, and courage—culminating in a battle not just for a crown, but for the soul of a kingdom.",21.2762,/bESlrLOrsQ9gKzaGQGHXKOyIUtX.jpg,2025-12-14,False,False,8.1,146,,,,,,
False,/mJDCrEFKHUqoZe4xyI8CE47pw7P.jpg,"878,9648,53",1101383,The End of Oak Street,en,The End of Oak Street,"After a mysterious cosmic event rips Oak Street from suburbia and transports their neighborhood to someplace unknown, the Platt family soon discovers that their very survival depends on them sticking together as they navigate their now unrecognizable surroundings.",21.203,/60bRdW7JTXTaSMFgLHjcoS1fXHh.jpg,2026-08-12,False,False,0.0,0,,,,,,
False,/sDTnMOJ3H5wI38OxObmCtK7wfd5.jpg,"16,35,10751,14",585,"Monsters, Inc.",en,"Monsters, Inc.","Lovable Sulley and his wisecracking sidekick Mike Wazowski are the top scare team at Monsters, Inc., the scream-processing factory in Monstropolis. When a little girl named Boo wanders into their world, it's the monsters who are scared silly, and it's up to Sulley and Mike to keep her out of sight and get her back home.",21.1863,/wFSpyMsp7H0ttERbxY7Trlv8xry.jpg,2001-11-01,False,False,7.85,19777,,,,,,
False,/Adrip2Jqzw56KeuV2nAxucKMNXA.jpg,37,429,"The Good, the Bad and the Ugly",it,"Il buono, il brutto, il cattivo","While the Civil War rages on between the Union and the Confederacy, three men – a quiet loner, a ruthless hitman, and a Mexican bandit – comb the American Southwest in search of a strongbox containing $200,000 in stolen gold.",21.1615,/bX2xnavhMYjWDoZp1VM6VnU1xwe.jpg,1966-12-23,False,False,8.5,9659,,,,,,
False,/xgDj56UWyeWQcxQ44f5A3RTWuSs.jpg,"16,35,10751,14",2062,Ratatouille,en,Ratatouille,"Remy, a rat, possesses a palate far more refined than that of his fellow comrades. He dreams of becoming a chef, one who creates rather than scavenges. When fate deposits him in the sewers beneath one of Paris’s most famous restaurants, he finds himself ideally placed to fulfill his dream. Forming an unusual alliance with a hapless young kitchen worker, Remy begins a daring culinary double life.  As Remy pursues his vision, he must navigate the suspicions of the calculating Head Chef Skinner, the disapproval of Remy’s own colony, and the foreboding presence of renowned food critic Anton Ego, who strikes fear in the hearts of chefs all throughout France.",21.143,/t3vaWRPSf6WjDSamIkKDs1iQWna.jpg,2007-06-28,False,False,7.841,18476,,,,,,
False,/ecKQlAEG95k62SMGhvX83oEqANK.jpg,"27,53",138843,The Conjuring,en,The Conjuring,"Paranormal investigators Ed and Lorraine Warren work to help a family terrorized by a dark presence in their farmhouse. Forced to confront a powerful entity, the Warrens find themselves caught in the most terrifying case of their lives.",21.1069,/wVYREutTvI2tmxr6ujrHT704wGF.jpg,2013-07-18,False,False,7.539,12721,,,,,,
False,/iWak7wT0j6ycCc8lKr4NBz9c7n5.jpg,"9648,53,18",210577,Gone Girl,en,Gone Girl,"With his wife's disappearance having become the focus of an intense media circus, a man sees the spotlight turned on him when it's suspected that he may not be innocent.",21.0461,/ts996lKsxvjkO2yiYG0ht4qAicO.jpg,2014-10-01,False,False,7.89,19975,,,,,,
False,/o3i6AfTcWAuNvzAUV3q5lOmi6Gx.jpg,"16,10751,12,18,35",150540,Inside Out,en,Inside Out,"When 11-year-old Riley moves to a new city, her Emotions team up to help her through the transition. Joy, Fear, Anger, Disgust and Sadness work together, but when Joy and Sadness get lost, they must journey through unfamiliar places to get back home.",20.9878,/2H1TmgdfNtsKlU9jKdeNyYL5y8T.jpg,2015-06-17,False,False,7.91,23461,,,,,,
False,/3UbaCMmqOd7mca4Y5DOzY2ZVTyX.jpg,"28,12,14",122917,The Hobbit: The Battle of the Five Armies,en,The Hobbit: The Battle of the Five Armies,"Following Smaug's attack on Laketown, Bilbo and the dwarves try to defend Erebor's mountain of treasure from others who claim it: the men of the ruined Laketown and the elves of Mirkwood. Meanwhile an army of Orcs led by Azog the Defiler is marching on Erebor, fueled by the rise of the dark lord Sauron. Dwarves, elves and men must unite, and the hope for Middle-Earth falls into Bilbo's hands.",20.9816,/xT98tLqatZPQApyRmlPL12LtiWp.jpg,2014-12-10,False,False,7.335,15367,,,,,,
False,/7iUDfakacY1HpajP1DtHrCuDB95.jpg,"16,35,10751",863,Toy Story 2,en,Toy Story 2,"Andy heads off to Cowboy Camp, leaving his toys to their own devices. Things shift into high gear when an obsessive toy collector named Al McWhiggen, owner of Al's Toy Barn kidnaps Woody. Andy's toys mount a daring rescue mission, Buzz Lightyear meets his match and Woody has to decide where he and his heart truly belong.",20.9381,/4rbcp3ng8n1MKHjpeqW0L7Fnpzz.jpg,1999-10-30,False,False,7.607,14889,,,,,,
False,/3upEZ0ltY7WwOSFVXrtiP34D48p.jpg,"53,18,10749",290098,The Handmaiden,ko,아가씨,"1930s Korea, in the period of Japanese occupation, a new girl, Sook-hee, is hired as a handmaiden to a Japanese heiress, Hideko, who lives a secluded life on a large countryside estate with her domineering Uncle Kouzuki. But the maid has a secret. She is a pickpocket recruited by a swindler posing as a Japanese Count to help him seduce the Lady to steal her fortune.",20.9086,/dLlH4aNHdnmf62umnInL8xPlPzw.jpg,2016-06-01,False,False,8.187,4323,,,,,,
False,/zIOBTZAqGwdKnOb5c6SvzxP7x86.jpg,"53,10749",1446616,Tu Yaa Main,hi,तू या मैं,"A wannabe rapper from the outskirts of Mumbai and an affluent influencer elope to a coastal town, only to find themselves trapped in the pool of a derelict resort fighting for survival against the wrath of a ferocious crocodile.",20.9071,/nUPnA0I1MTaZRVCsUQc5DS5JA8W.jpg,2026-02-11,False,False,6.456,45,,,,,,
False,/ihIVjdiuvtVuFUaCqfNJwajIs3i.jpg,"14,10402",13192,Moonwalker,en,Moonwalker,This fantastical movie inspired by the music of Michael Jackson features imaginative interpretations of hit tracks from the iconic 1987 album “Bad”.,20.8976,/3GwTPQkAcgDeAirRpEuJG8HDdRz.jpg,1988-10-29,False,False,7.072,654,,,,,,
False,/3N5QNUqS76GFYNoEayfkkJyAyTN.jpg,"35,12,14",346698,Barbie,en,Barbie,"Barbie and Ken are having the time of their lives in the colorful and seemingly perfect world of Barbie Land. However, when they get a chance to go to the real world, they soon discover the joys and perils of living among humans.",20.8913,/iuFNMS8U5cb6xfzi51Dbkovj7vM.jpg,2023-07-19,False,False,6.9,11117,,,,,,
False,/4s2d3xdyqotiVNHTlTlJjrr3q0H.jpg,"12,10751,16,28,35",177572,Big Hero 6,en,Big Hero 6,"A special bond develops between plus-sized inflatable robot Baymax, and prodigy Hiro Hamada, who team up with a group of friends to form a band of high-tech heroes.",20.89,/2mxS4wUimwlLmI1xp6QW6NSU361.jpg,2014-10-24,False,False,7.725,16593,,,,,,
False,/2iqLoDsatVBwAvHTEzI71p3qBe9.jpg,"99,80",1662317,The Crash,en,The Crash,"A teen slams her car into a building, killing her boyfriend and his friend. What seems like a tragic accident becomes a murder case.",20.8753,/veskdPx4YUTmkrFrTs6zRJ8VV4E.jpg,2026-05-14,False,False,6.9,95,,,,,,
False,/jJJQ1PPXUEchqyZ9YyWzgSNU39Z.jpg,"28,80,53",581528,"The Gangster, the Cop, the Devil",ko,악인전,"After barely surviving a brutal attack by a sadistic serial killer, crime boss Jang Dong-su is left humiliated. Determined to catch the killer known as K, he forms an uneasy alliance with Jung Tae-seok, a relentless and incorruptible detective who often disrupts his illegal business. However, while Jang Dong-su wants K dead, Jung Tae-suk is determined to bring him to justice. With a deal in place—whoever finds K first will decide his fate—the hunt begins, blurring the lines between crime and law.",20.8683,/oHlM4abRm6BzrRcz9Nup1uidw9H.jpg,2019-05-15,False,False,7.859,1470,,,,,,
False,/vDR2h5uQNgWyx3fsEVnEOcNFibZ.jpg,"53,80,10770",801335,Girl in the Basement,en,Girl in the Basement,"Sara is a teen girl who is looking forward to her 18th birthday to move away from her controlling father Don. But before she could even blow out the candles, Don imprisons her in the basement of their home.",20.8412,/tPP9n6r5QrIKPnshnJqE7klptj2.jpg,2021-02-27,False,False,7.556,860,,,,,,
False,/bzb6BDskaYbRvXMIENcqFdgwiY0.jpg,"35,10749",12779,Swept Away,en,Swept Away,"Stranded and alone on a desert island during a cruise, a spoiled rich woman and a deckhand fall in love and make a date to reunite after their rescue.",20.8248,/rAa3nTeDpwgLX6XxnT3wR86C5WE.jpg,2002-10-11,False,False,4.7,312,,,,,,
False,/afVowAl99Vqjo3Ji6RyFI17Tk5r.jpg,"35,36",145341,Colonel Kwiatkowski,pl,Pułkownik Kwiatkowski,"Military doctor Kwiatkowski, serving in a barracks hospital on the Western Territories, is rewarded with a week’s leave after successfully operating on Colonel Kiziora of the UB. He and his friend steal a truck bound for Warsaw, where among the ruins of his former home he meets his prewar neighbor Krysia, instantly falls in love, and, after a brawl with a Russian officer at a dance in the surviving “Polonia” hotel, pretends to be a high-ranking UB colonel to save face.",20.8042,/q6Jb1IdOJ8k7QO9vk3tJkaMGyIF.jpg,1996-05-10,False,False,6.7,32,,,,,,
False,/sZ61Fo6Di1DvXXhrSjyF6Xunr9C.jpg,"18,53",1380316,Is God Is,en,Is God Is,"Two sisters embark on an epic quest for revenge, confronting a charged family history that pushes them to extraordinary lengths.",20.7767,/c3nN8XnbYfj2ZEBcNqqlTbtLiQy.jpg,2026-05-14,False,False,5.87,23,,,,,,
False,/jQ89PbSNQ1mcd4YZiaLsiIaflFM.jpg,"35,10751",1440050,The Breadwinner,en,The Breadwinner,After his wife Katie lands a once-in-a-lifetime deal on Shark Tank that takes her on a prolonged business trip - lifelong breadwinner Nate Wilcox now has to fend for his family as a first-time stay-at-home dad.,20.7061,/4apG9Xk6HQvV48JKEjSUeiebju7.jpg,2026-05-28,False,False,7.5,2,,,,,,
False,/iuRVt8tFiXDPGgzavhuSa3QHRxD.jpg,35,18785,The Hangover,en,The Hangover,"When three friends finally come to after a raucous night of bachelor-party revelry, they find a baby in the closet and a tiger in the bathroom. But they can't seem to locate their best friend, Doug – who's supposed to be tying the knot. Launching a frantic search for Doug, the trio perseveres through a nasty hangover to try to make it to the church on time.",20.4539,/A0uS9rHR56FeBtpjVki16M5xxSW.jpg,2009-06-02,False,False,7.332,18100,,,,,,
False,/cbcpDn6XJaIGoOil1bKuskU8ds4.jpg,"12,14",12445,Harry Potter and the Deathly Hallows: Part 2,en,Harry Potter and the Deathly Hallows: Part 2,"Harry, Ron and Hermione continue their quest to vanquish the evil Voldemort once and for all. Just as things begin to look hopeless for the young wizards, Harry discovers a trio of magical objects that endow him with powers to rival Voldemort's formidable skills.",20.3815,/c54HpQmuwXjHq2C9wmoACjxoom3.jpg,2011-07-12,False,False,8.08,21987,,,,,,
False,/qdthf9WrRDSaIkGVQGhhJ9pz1hn.jpg,"28,16,35,10751",9502,Kung Fu Panda,en,Kung Fu Panda,"Chosen by prophecy but doubted by all, Po is an unlikely choice for the mystical title of the Dragon Warrior—a clumsy panda thrust into the world of kung fu as a deadly enemy threatens the Valley of Peace. Under reluctant guidance by Master Shifu and the Furious Five, Po must embrace who he is to unlock the power that no scroll can teach.",20.3401,/wWt4JYXTg5Wr3xBW2phBrMKgp3x.jpg,2008-06-04,False,False,7.323,12642,,,,,,
False,/ohlNSR8MsHk5e6fcAxqAJmcz4Sm.jpg,"36,10752,28,18",898704,Desert Warrior,en,Desert Warrior,"In 7th-century Arabia, Princess Hind becomes a warrior to defy the ruthless Emperor Kisra. Forged into a warrior and aided by legendary bandit Hanzala, Hind unites warring tribes for a last stand—the historic Battle of Dhi Qar—that will change history.",20.3292,/waxnw1NpzTPY5JkqWvu0muSopRJ.jpg,2026-04-23,False,False,5.8,15,,,,,,
False,/cEobq5QrnOJjO6giDs8q4RxmMKh.jpg,"27,878",348,Alien,en,Alien,"During its return to the earth, commercial spaceship Nostromo intercepts a distress signal from a distant planet. When a three-member team of the crew discovers a chamber containing thousands of eggs on the planet, a creature inside one of the eggs attacks an explorer. The entire crew is unaware of the impending nightmare set to descend upon them when the alien parasite planted inside its unfortunate host is birthed.",20.3108,/vfrQk5IPloGg1v9Rzbh2Eg3VGyM.jpg,1979-05-25,False,False,8.17,16388,,,,,,
False,/5rxEnsgriw8z065q51lrvPKYmCL.jpg,"10749,18",1367642,Reminders of Him,en,Reminders of Him,"When Diem's custodial grandparents adamantly refuse Kenna's attempts to see her daughter, Kenna discovers unexpected compassion, and then something truer and deeper, with former NFL player and local bar owner Ledger. As their secret romance develops, so do the dangers for both of them, leading Kenna toward heartbreak and, ultimately, the hope for a second chance.",20.2823,/7L6rceYgzQ0NeHD7PRDNrRoQ291.jpg,2026-03-11,False,False,7.636,272,,,,,,
False,/iVped1djsF0tvGkvnHbzsE3ZPTF.jpg,"28,12,878",68721,Iron Man 3,en,Iron Man 3,"When Tony Stark's world is torn apart by a formidable terrorist called the Mandarin, he starts an odyssey of rebuilding and retribution.",20.2709,/qhPtAc1TKbMPqNvcdXSOn9Bn7hZ.jpg,2013-04-18,False,False,6.933,23432,,,,,,
False,/q8Qlpmp2my1IZV9EVebzvhhJPmy.jpg,"28,10749,53",1220522,Dacoit,te,డెకాయిట్,"Betrayed by his better half, a man is convicted for a crime he didn't commit. Once free, he hunts her down in pursuit of vengeance, as their stories intertwine with a series of robberies.",20.2678,/530ELGtiZKTUpyxEvP2ufzz8bJB.jpg,2026-04-10,False,False,6.2,4,,,,,,
False,/6zKjoOOb3OZnZuiHtQZn4Kd69Gq.jpg,"27,53",1197137,Black Phone 2,en,Black Phone 2,"Four years after defeating The Grabber, Finney Blake is struggling with life after captivity. When his younger sister Gwen begins receiving calls in her dreams from the Black Phone and seeing disturbing visions of three boys being stalked at a winter camp, the siblings become determined to solve the mystery and confront a killer who has grown more powerful in death and more significant to them than either could imagine.",20.2111,/gFddBLQ8wj9M9O82iPzgX5KVNHz.jpg,2025-10-15,False,False,6.691,1125,,,,,,
False,/5bzPWQ2dFUl2aZKkp7ILJVVkRed.jpg,"12,35,878",105,Back to the Future,en,Back to the Future,"Eighties teenager Marty McFly is accidentally sent back in time to 1955, inadvertently disrupting his parents' first meeting and attracting his mother's romantic interest. Marty must repair the damage to history by rekindling his parents' romance and - with the help of his eccentric inventor friend Doc Brown - return to 1985.",19.7597,/vN5B5WgYscRGcQpVhHl6p9DDTP0.jpg,1985-07-03,False,False,8.326,21828,,,,,,
False,/kIBK5SKwgqIIuRKhhWrJn3XkbPq.jpg,"28,12,878",99861,Avengers: Age of Ultron,en,Avengers: Age of Ultron,"When Tony Stark tries to jumpstart a dormant peacekeeping program, things go awry and Earth’s Mightiest Heroes are put to the ultimate test as the fate of the planet hangs in the balance. As the villainous Ultron emerges, it is up to The Avengers to stop him from enacting his terrible plans, and soon uneasy alliances and unexpected action pave the way for an epic and unique global adventure.",20.1098,/4ssDuvEDkSArWEdyBl2X5EHvYKU.jpg,2015-04-22,False,False,7.273,24442,,,,,,
False,/wspOfgFVJde2jjD4vlIqy5Jc3yy.jpg,18,1669057,Check-In,tl,Check-In,"VMX hottest star Aliya Raymundo teams up with sexy siren Anya Austria as two receptionists in a cheap motel. Their quiet routine heats up with the arrival of a mysterious regular guest who begins to stir tension, desire, and conflict in their fragile relationship.",20.0356,/r7tXZoO3rfkOpYQPCXftwugwny9.jpg,2026-05-01,False,False,5.0,2,,,,,,
False,/jr8tSoJGj33XLgFBy6lmZhpGQNu.jpg,"16,12,14,35,10751",315162,Puss in Boots: The Last Wish,en,Puss in Boots: The Last Wish,"Puss in Boots discovers that his passion for adventure has taken its toll: He has burned through eight of his nine lives, leaving him with only one life left. Puss sets out on an epic journey to find the mythical Last Wish and restore his nine lives.",19.9985,/kuf6dutpsT0vSVehic3EZIqkOBt.jpg,2022-12-07,False,False,8.2,8833,,,,,,
False,/vGjUCw8pKjYi1dq2hwC5kdqkLhs.jpg,"18,10749",107257,A Perfect Ending,en,A Perfect Ending,"This intimate drama follows Rebecca, a woman who has kept her sexuality a secret from her friends but chooses to reveal it to a stranger. While Rebecca's revelations may not yield the results she expects, a perfect ending is still in reach.",19.9931,/mjwWEwE1xdbtFGCOgeXi5jvQnOU.jpg,2012-06-01,False,False,6.241,137,,,,,,
False,/35coF6nTlCHZoBdmH7AJX47RwY9.jpg,"35,27,878",1297446,Slanted,en,Slanted,"An insecure Chinese-American teenager undergoes experimental surgery to appear white, hoping to secure the prom queen title and peer acceptance.",19.9772,/cr2SfN854IlEoZQBtIfpyC0zXR5.jpg,2026-03-13,False,False,6.229,35,,,,,,
False,/fPfDB0IHOqvmKIzFP9CA51OOS1N.jpg,"27,53",1010755,The Strangers: Chapter 3,en,The Strangers: Chapter 3,"Tethered by a frightening conclusion, Maya and the Strangers are locked on an unavoidable, unforgiving collision course — a showdown that proves they’re far from strangers now.",19.9144,/yPHwX78mcwJw3I6YOJ9qh2wQBFr.jpg,2026-02-05,False,False,5.736,182,,,,,,
False,/aLhtnH4pKHnD02ZfBGm2djwlNBH.jpg,"16,99",426889,Le Clitoris,fr,Le Clitoris,"Women are lucky, they get to have the only organ in the human body dedicated exclusively for pleasure: the clitoris! In this humorous and instructive animated documentary, find out its unrecognized anatomy and its unknown herstory.",19.8936,/osBGGlyIwsnSDIJ3vy83JpH1OUY.jpg,2017-08-24,False,False,6.756,43,,,,,,
False,/ofxq93dSF85goDtNfQoquo8LTWS.jpg,"18,10751",63964,Deiva Thirumagal,ta,தெய்வத்திருமகள்,"An intellectually disabled man fights for custody of his 7-year-old daughter, and in the process teaches his opponent lawyer the value of love and family.",19.8675,/ovfLSxsgLFYm2ISjfH1Te0lNyEr.jpg,2011-06-03,False,False,7.3,31,,,,,,
False,/3V4kLQg0kSqPLctI5ziYWabAZYF.jpg,"878,28,12",912649,Venom: The Last Dance,en,Venom: The Last Dance,"Eddie and Venom are on the run. Hunted by both of their worlds and with the net closing in, the duo are forced into a devastating decision that will bring the curtains down on Venom and Eddie's last dance.",19.792,/vGXptEdgZIhPg3cGlc7e8sNPC2e.jpg,2024-10-22,False,False,6.669,4231,,,,,,
False,/AvYsEYnj8h0495UhBYEXqK7hkFo.jpg,"35,80,18,9648",1287571,Agak Laen: Menyala Pantiku!,id,Agak Laen: Menyala Pantiku!,"After repeatedly failing their missions, Detectives Bene, Boris, Jegel, and Oki are given one last chance: to go undercover in a nursing home in search of a fugitive wanted for the murder of the mayor’s child.",16.823,/fPJ9OjLgAQoLZrPeL6ZfQwNkfPK.jpg,2025-11-27,False,False,8.6,11,,,,,,
