adult,backdrop_path,genre_ids,id,title,original_language,original_title,overview,popularity,poster_path,release_date,softcore,video,vote_average,vote_count,runtime,budget,revenue,status,tagline,director
False,/rZfmzpixLKLR3Hg2u0WgC7XLFl8.jpg,27,1339713,Obsession,en,Obsession,"After breaking the mysterious ""One Wish Willow"" to win his crush's heart, a hopeless romantic finds himself getting exactly what he asked for but soon discovers that some desires come at a dark, sinister price.",653.5424,/6X4qFYBsG3bpWDG2XIKqr04kFJa.jpg,2026-05-13,False,False,7.909,509,108.0,750000.0,166601860.0,Released,Be careful who you wish for…,Curry Barker
False,/xugEpZk9YQ0DIz1aFvH5HGkqpZK.jpg,"27,9648",1304313,Lee Cronin's The Mummy,en,Lee Cronin's The Mummy,"The young daughter of a journalist disappears into the desert without a trace—eight years later, the broken family is shocked when she is returned to them, as what should be a joyful reunion turns into a living nightmare.",452.0792,/1q308iixueCU4pFtSYugNOevtNx.jpg,2026-04-15,False,False,8.056,1557,133.0,22000000.0,90152113.0,Released,What happened to Katie?,Lee Cronin
False,/jatqtz0VlQRiugmHktbKQpuf5EV.jpg,"80,18,53",1433117,Kara,ta,கர,"A thief tries to go straight, but when predatory banks trap his father in debt, he returns to crime — with a determined cop closing in on his trail.",451.6465,/uIrFdMWlJFdc1jPBP9bxeaISCDj.jpg,2026-04-30,False,False,6.067,15,161.0,0.0,0.0,Released,"Sometimes, staying dangerous is the only way to stay alive.",Vignesh Raja
False,/oUozq2XHWifwAVOoS1qHU0qfXqM.jpg,"27,9648,878",1083381,Backrooms,en,Backrooms,A strange doorway appears in the basement of a furniture showroom.,295.566,/rhGx6E3qRNMgj3i5su2oukNHwIQ.jpg,2026-05-27,False,False,6.727,295,111.0,10000000.0,134957843.0,Released,You are not supposed to be here.,Kane Parsons
False,/dd31qJxOarrHyGZwYsCzOjobQzP.jpg,"28,53",1380291,Tom Clancy's Jack Ryan: Ghost War,en,Tom Clancy's Jack Ryan: Ghost War,"Jack Ryan is reluctantly pulled back into espionage when an international covert mission unravels a deadly conspiracy. Racing against time, he joins CIA allies Mike November & James Greer and sharp MI6 officer Emma Marlowe to battle a rogue black-ops unit in a high-stakes, deeply personal fight.",269.0824,/8ehYxUh5MWE41AeE9gkHE8DKzvB.jpg,2026-05-20,False,False,7.108,462,107.0,0.0,0.0,Released,No operation stays dark forever.,Andrew Bernstein
False,/qO55CD8tgVL1T4WKn6zYFFiD6lL.jpg,"28,18,80",1439930,The Punisher: One Last Kill,en,The Punisher: One Last Kill,"As Frank Castle searches for meaning beyond revenge, an unexpected force pulls him back into the fight.",259.0049,/qQclTgLMDvGBuUBFGHRipxkEwWR.jpg,2026-05-12,False,False,8.368,1439,51.0,0.0,0.0,Released,Hey Frank.,Reinaldo Marcus Green
False,/2I1OFQJ0L9T0dpU6FobKFWV2PxX.jpg,"878,12",687163,Project Hail Mary,en,Project Hail Mary,"Science teacher Ryland Grace wakes up on a spaceship light years from home with no recollection of who he is or how he got there. As his memory returns, he begins to uncover his mission: solve the riddle of the mysterious substance causing the sun to die out. He must call on his scientific knowledge and unorthodox ideas to save everything on Earth from extinction.",248.9187,/yihdXomYb5kTeSivtFndMy5iDmf.jpg,2026-03-15,False,False,8.654,4590,157.0,200000000.0,676716397.0,Released,Believe in the Hail Mary.,Phil Lord
False,/9Z2uDYXqJrlmePznQQJhL6d92Rq.jpg,"10751,35,12,14,16",1226863,The Super Mario Galaxy Movie,en,The Super Mario Galaxy Movie,"Having thwarted Bowser's previous plot to marry Princess Peach, Mario and Luigi now face a fresh threat in Bowser Jr., who is determined to liberate his father from captivity and restore the family legacy. Alongside companions new and old, the brothers travel across the stars to stop the young heir's crusade.",239.9882,/eJGWx219ZcEMVQJhAgMiqo8tYY.jpg,2026-04-01,False,False,8.1,2311,98.0,110000000.0,991800000.0,Released,The galaxy awaits.,Michael Jelenic
False,/gRoZG3Z0zJxgElmTsVHOl2dNYXe.jpg,"28,80,53",1582770,Dhurandhar: The Revenge,hi,धुरंधर: द रिवेंज,"As rival gangs, corrupt officials and a ruthless Major Iqbal close in, Hamza's mission for his country spirals into a bloody personal war where the line between patriot and monster disappears in the streets of Lyari.",232.3277,/ov8vrRLZGoXHpYjSY9Vpv1tHJX7.jpg,2026-03-18,False,False,7.3,106,229.0,14330000.0,210000000.0,Released,The story of the unknown men unfolds.,Aditya Dhar
False,/1x9e0qWonw634NhIsRdvnneeqvN.jpg,"10749,18",1523145,Your Heart Will Be Broken,ru,Твоё сердце будет разбито,"High school student Polina is saved from bullying at her new school and makes a deal with the main bully Bars: he must pretend to be her boyfriend and protect her, and she must do everything he says. During this game, the couple develops real feelings, but her family and classmates have reasons to separate the lovers.",221.3552,/7wIBfBl2gejt6xHxNSK0reVIm7E.jpg,2026-03-26,False,False,6.8,83,134.0,3716000.0,7578000.0,Released,,Mikhail Vaynberg
False,/nTimAHDG7PoycFF2afMZVPyOokg.jpg,"28,53",1065834,Kattalan,ml,കാട്ടാളൻ,"Power-hungry forces clash in the Ivory cartel war-a fierce story of control, vengeance, and survival where compassion vanishes and only the ruthless endure.",220.0827,/slHheGTTGFXBCt6l0lQFSj7gNUh.jpg,2026-05-14,False,False,6.0,1,119.0,0.0,0.0,Released,THE HUNTER,Paul George
False,/zMwhWailP1WY7sb6AoE6b8ugoy.jpg,"12,16,10751,14",1007757,Swapped,en,Swapped,"A small woodland creature and a majestic bird, two natural sworn enemies of the Valley, magically trade places and set off on an adventure of a lifetime to switch back. Their journey soon uncovers a greater threat—one that could endanger not only their species, but the entire valley they call home.",220.0411,/tHhxWxge06goXU6ZQH1hj7vK8Hd.jpg,2026-05-01,False,False,8.968,1549,102.0,0.0,0.0,Released,Transform your destiny.,Nathan Greno
False,/tlm8UkiQsitc8rSuIAscQDCnP8d.jpg,"28,878",603,The Matrix,en,The Matrix,"Set in the 22nd century, The Matrix tells the story of a computer hacker who joins a group of underground insurgents fighting the vast and powerful computers who now rule the earth.",187.6615,/aOIuZAjPaRIE6CMzbazvcHuHXDc.jpg,1999-03-31,False,False,8.247,27939,136.0,63000000.0,463517383.0,Released,Believe the unbelievable.,Lana Wachowski
False,/4BtL2vvEufDXDP4u6xQjjQ1Y2aT.jpg,"28,80,18,53",1419406,The Shadow's Edge,zh,捕风追影,Macau Police brings the tracking expert police officer out of retirement to help catch a dangerous group of professional thieves.,174.0368,/cHKo3m8N1fwvEy2ZEr0xGmmMODV.jpg,2025-08-16,False,False,7.579,762,142.0,0.0,174400000.0,Released,He's training a new generation of law enforcers for a dangerous mission to save the world from ruthless criminals.,Larry Yang
False,/kkRpcauZoBFKnH0Qsy7J5qtwBF5.jpg,"10749,18",1371023,Chand Mera Dil,hi,चाँद मेरा दिल,"Aarav and Chandni's passionate college romance is struck by adulthood far too soon, forcing the two young lovers to balance their ambitions with responsibility and realize the evolved meaning of love.",162.5339,/9LPkXJustudEBgPZEm9tgDx5KtC.jpg,2026-05-22,False,False,3.833,3,142.0,0.0,0.0,Released,When love grows faster than life,Vivek Soni
False,/woZX9wZaiX70LbW7bOeNccNTIhp.jpg,27,1430077,Hokum,en,Hokum,"When novelist Ohm Bauman retreats to a remote inn to scatter his parents' ashes, he is consumed by tales of a witch haunting the honeymoon suite. Disturbing visions and a shocking disappearance forces him to confront dark corners of his past.",160.1667,/jKPWwsbAM6HKURPYQ1eG8DmKMKn.jpg,2026-04-29,False,False,7.0,103,107.0,5000000.0,23563104.0,Released,We've been expecting you.,Damian McCarthy
False,/gqGQ0zADV5FIcgMWtWX8FcGQjFp.jpg,"27,9648,878",1116201,Iron Lung,en,Iron Lung,"In a post-apocalyptic future where an event known as ""The Quiet Rapture"" caused all known stars and habitable planets in the universe to disappear, a convict is sent to search an ocean of blood discovered on a desolate moon, using a small submarine nicknamed the ""Iron Lung"".",154.12,/sIwakdbMGS1krtgendTWpxTY9Hw.jpg,2026-01-30,False,False,7.209,199,125.0,4000000.0,51226173.0,Released,This is not an expedition. It's an execution.,Mark Fischbach
False,/g8jcF5MhO5o5W7XYli4Zuc7LGGW.jpg,"14,12,28,10402",104594,The Cave of the Silken Web,zh,盤絲洞,"Monkey King, Pig and Friar Sand must rescue his master Buddhist monk from seven witches / spiders who believe themselves to be immortal if they eat the monk's flesh. The third part of the Shaw Brothers film series about Monkey King after the novel ""Journey to the West.""",148.9515,/lEvNC9J2UzWc3PkptXMGcGVxSNq.jpg,1967-07-31,False,False,5.727,11,82.0,0.0,0.0,Released,,Ho Meng-Hua
False,/6DfHl4CE88x7Rt9oyARQQm6bHXD.jpg,"28,53",1510339,Mark,kn,ಮಾರ್ಕ್,"Mark is suspended from his police duties for his unruly yet effective ways of operating, but when 18 children are abducted and found dead, races to catch the criminals. With only 18 hours left, he must confront powerful foes and use unconventional tactics to succeed.",148.1475,/6LTDv6XHiHN0N77QIFg2tidVvhh.jpg,2025-12-25,False,False,4.0,1,144.0,0.0,0.0,Released,,Vijay Kartikeyaa
False,/oBft4BZeoDQzTT9ZGijClr76qvK.jpg,"28,53",1122573,In the Grey,en,In the Grey,"A covert team of elite operatives are living in the shadows. When a ruthless despot steals a billion-dollar fortune, they're sent to take it back—an impossible heist that erupts into a deadly game of strategy, deception and survival.",146.5599,/dQgIcW6Th08kMRf2HBoYWoFE6OD.jpg,2026-05-13,False,False,6.6,115,97.0,70000000.0,13478954.0,Released,"When billions get stolen, meet the pros who steal it back.",Guy Ritchie
False,/xGJT18qN8lzELAnHRyfoe1vLTiI.jpg,18,186745,Rape of Love,fr,L'Amour violé,"Nicole, nurse in Grenoble, is raped one night by four men. Deeply scarred, emotionally and physically, she thinks she will never recover from the trauma. Following a friend's advice, she decides to file a lawsuit.",144.9266,/qVGL9xgGCzXtRwexUTmpz7z1MVg.jpg,1978-01-10,False,False,5.6,24,115.0,0.0,0.0,Released,,Yannick Bellon
False,/rHnANzYUmV3WZw3n0yWOLiR3pen.jpg,"53,80",976912,Graphic Desires,en,Graphic Desires,"When reclusive Franklin cheats on his partner with a mysterious girl he meets on a dating app, it becomes the start of a deadly obsession.",144.0315,/3BjLdTWRiHc1ISIZMFvToOmghOM.jpg,2023-08-31,False,False,6.951,81,90.0,0.0,0.0,Released,An erotic thriller for the Tinder generation.,Andy Edwards
False,/vP7YFt9pP8NPCg4PMBAHO5ILdrQ.jpg,"28,53",44980,Zero Woman 2,ja,Zero WOMAN ＩＩ　警視庁０課の女,"When a valuable suitcase is stolen, the mob, petty criminals, and a beautiful agent from the Elite Zero division are pulled into a battle to settle the score.",143.3974,/sQHeDjwmBQba8E51Mkp5dvgkzeZ.jpg,1995-09-05,False,False,5.0,8,99.0,0.0,0.0,Released,,Daisuke Gotô
False,/iN41Ccw4DctL8npfmYg1j5Tr1eb.jpg,"878,12,14",83533,Avatar: Fire and Ash,en,Avatar: Fire and Ash,"In the wake of the devastating war against the RDA and the loss of their eldest son, Jake Sully and Neytiri face a new threat on Pandora: the Ash People, a violent and power-hungry Na'vi tribe led by the ruthless Varang. Jake's family must fight for their survival and the future of Pandora in a conflict that pushes them to their emotional and physical limits.",139.7246,/aabwWZWx6z1aYP4PX2ADvbDKktd.jpg,2025-12-17,False,False,7.547,3312,198.0,350000000.0,1490477656.0,Released,The world of Pandora will change forever.,James Cameron
False,/gQq1r3H0QgM9h72o2OpOV5kTOpG.jpg,"18,53",405818,Door II: Tokyo Diary,ja,Door II: Tokyo Diary,Ai is a call girl that makes good money for what she does but there’s always at risk no matter how good the money is.,134.4561,/lskJ34j4VKwbMwcvFSQeNYEdt8g.jpg,1991-04-25,False,False,6.1,14,82.0,0.0,0.0,Released,,Banmei Takahashi
False,/6zg7A9ICOthNR2TSXlT51KvXrsA.jpg,"28,12,878",1228710,The Mandalorian and Grogu,en,The Mandalorian and Grogu,"The evil Empire has fallen, and Imperial warlords remain scattered throughout the galaxy. As the fledgling New Republic works to protect everything the Rebellion fought for, they have enlisted the help of legendary Mandalorian bounty hunter Din Djarin and his young apprentice Grogu.",132.8695,/5Vi8dSauVwH1HOsiZceDMbRr1Ca.jpg,2026-05-20,False,False,6.837,386,132.0,165000000.0,246600000.0,Released,"If you're searching for new adventure, ""this is the way.""",Jon Favreau
False,/4EAAwpylq313qrDqpCxulUrXBNF.jpg,"28,14,12",931285,Mortal Kombat II,en,Mortal Kombat II,"The fan favorite champions—now joined by Johnny Cage himself—are pitted against one another in the ultimate, no-holds barred, gory battle to defeat the dark rule of Shao Kahn that threatens the very existence of the Earthrealm and its defenders.",130.1453,/lIsMeDbwntNXSUVHmWMMRXEZOVc.jpg,2026-05-06,False,False,6.739,370,116.0,80000000.0,126827614.0,Released,Their fight. Our future.,Simon McQuoid
False,/5n417Ff5GXOGCOKj3ZLMRAxEP0o.jpg,"18,9648",249397,Nymphomaniac: Vol. II,en,Nymphomaniac: Vol. II,The continuation of Joe's sexually dictated life delves into the darker aspects of her adult life and what led to her being in Seligman's care.,130.0159,/iLUNqgNKuWn667kXCKztSxYbT3k.jpg,2013-12-25,False,False,6.712,3171,124.0,2350000.0,4934725.0,Released,Forget about love.,Lars von Trier
False,/1eAuwNBy34kkM3xkl202z4f1NiI.jpg,"28,14",1367220,Karuppu,ta,கருப்பு,"In a world where justice falters, guardian deity Vettai Karuppu takes the guise of a lawyer to battle a corrupt legal system preying on the powerless.",129.9259,/4KZXlZ5tTT6ghbW77gS4hSLkCd7.jpg,2026-05-14,False,False,7.364,11,151.0,0.0,0.0,Released,,RJ Balaji
False,/u53UYu5XG2hNgWGvs3xGhAVzypl.jpg,"12,16,35,10751,878",1327819,Hoppers,en,Hoppers,"Scientists have discovered how to 'hop' human consciousness into lifelike robotic animals, allowing people to communicate with animals as animals. Animal lover Mabel seizes an opportunity to use the technology, uncovering mysteries within the animal world beyond anything she could have imagined.",122.7852,/xjtWQ2CL1mpmMNwuU5HeS4Iuwuu.jpg,2026-03-04,False,False,8.161,1375,104.0,150000000.0,372002428.0,Released,Act natural.,Daniel Chong
False,/eNAFLrd1XAAD4hgdTPjewpzYU4W.jpg,35,1320660,Pati Patni Aur Woh Do,hi,पति पत्नी और वो दो,"A seemingly perfect marriage in Prayagraj takes an unexpected turn when one decision leads to a chain of misunderstandings, suspicion, and comedic chaos.",122.4753,/x0RUPvba4JlCCkyyEZGlQFIFVuF.jpg,2026-05-15,False,False,7.5,4,117.0,0.0,0.0,Released,,Mudassar Aziz
False,/6ELCZlTA5lGUops70hKdB83WJxH.jpg,"28,14,12",460465,Mortal Kombat,en,Mortal Kombat,"Washed-up MMA fighter Cole Young, unaware of his heritage, and hunted by Emperor Shang Tsung's best warrior, Sub-Zero, seeks out and trains with Earth's greatest champions as he prepares to stand against the enemies of Outworld in a high stakes battle for the universe.",122.3292,/ybrX94xQm8lXYpZAPRmwD9iIbWP.jpg,2021-04-07,False,False,7.037,6692,110.0,20000000.0,84426031.0,Released,Get over here!,Simon McQuoid
False,/5AsIFZ2AJC7JcGpq40aRPuRuaRc.jpg,18,1241752,Rita,tl,Rita,"Rita, who finds herself alone when husband Ariel works abroad. They both find solace and sexual satisfaction in other people. When Ariel comes back, they both act like nothing happened. But will this keep their marriage from falling apart?",121.9192,/pXENxAzOBrTSDJGxDcUnlNTNmWr.jpg,2024-03-22,False,False,6.2,23,113.0,1.0,2.0,Released,,Jerry Lopez Sineneng
False,/krhj4Fhb0G3QCmyBtEADxgFFmRX.jpg,"18,10749",11012,Damage,en,Damage,The life of a respected British politician at the height of his career crumbles when he becomes obsessed with his son's lover.,121.8626,/alf3JOPP7EYP0iO24gwe5YfRnqo.jpg,1992-12-02,False,False,6.56,682,111.0,11000000.0,31000000.0,Released,Desire... Deceit... Destiny...,Louis Malle
False,/gkh6Nt8DtY1XT4gQsyFq9XAVJlJ.jpg,"18,35",350,The Devil Wears Prada,en,The Devil Wears Prada,"A young woman from the Midwest gets more than she bargained for when she moves to New York to become a writer and ends up as the assistant to the tyrannical, larger-than-life editor-in-chief of a major fashion magazine.",117.2846,/8912AsVuS7Sj915apArUFbv6F9L.jpg,2006-06-29,False,False,7.428,13649,109.0,35000000.0,326588371.0,Released,Meet Andy Sachs. A million girls would kill to have her job. She's not one of them.,David Frankel
False,/sb76azrAXr9U13uEQxNP5e3fujY.jpg,"28,35,53",1390300,Over Your Dead Body,en,Over Your Dead Body,"A dysfunctional couple head to a remote cabin to ""reconnect"", but each has secret intentions to kill the other.",114.5368,/6yPvopLmtoyxzJt6Cr0BRyFxtrd.jpg,2026-04-24,False,False,6.841,88,106.0,0.0,2055131.0,Released,Breakups are all in the execution.,Jorma Taccone
False,/cfDHxkco8RrslL0Vk2XPTwTVFCe.jpg,"28,53",1472951,Infiltrate,en,Infiltrate,"In a city overrun by crime, government Agent Lily Chen is forced to choose between her duty and her family when her husband is kidnapped, and she’s blackmailed into assassinating high-level criminals to save him. As she delves deeper into the criminal underworld, Lily’s relentless pursuit of justice unravels a web of corruption, leading to a final, life-altering decision that will change her world forever.",110.1585,/8Cw8GF9wG63kF8pRRXwOx2kXGt.jpg,2026-04-10,False,False,5.469,16,93.0,0.0,0.0,Released,,James Mark
False,/1RgPyOhN4DRs225BGTlHJqCudII.jpg,"16,28,14",1311031,Demon Slayer: Kimetsu no Yaiba Infinity Castle,ja,劇場版「鬼滅の刃」無限城編 第一章 猗窩座再来,"The Demon Slayer Corps are drawn into the Infinity Castle, where Tanjiro, Nezuko, and the Hashira face terrifying Upper Rank demons in a desperate fight as the final battle against Muzan Kibutsuji begins.",106.0452,/fWVSwgjpT2D78VUh6X8UBd2rorW.jpg,2025-07-18,False,False,7.728,847,156.0,20000000.0,733030221.0,Released,It's time to have some fun.,Haruo Sotozaki
False,/xBT0oNq6rsTFv4SxG5uGRIEOrq6.jpg,"10402,18",936075,Michael,en,Michael,"The story of Michael Jackson, one of the most influential artists the world has ever known, and his life beyond the music. His journey from the discovery of his extraordinary talent as the lead of the Jackson Five, to the visionary artist whose creative ambition fueled a relentless pursuit to become the biggest entertainer in the world, highlighting both his life off-stage and some of the most iconic performances from his early solo career.",102.044,/zm0KAbOjlt9eR5y7vDiL2dEOwMl.jpg,2026-04-22,False,False,7.582,904,128.0,250000000.0,851300000.0,Released,Discover the making of a king.,Antoine Fuqua
False,/tq3h43fZy0H80vzf47MAY7R9Mxo.jpg,"16,35,10751",1297842,GOAT,en,GOAT,"A small goat with big dreams gets a once-in-a-lifetime shot to join the pros and play roarball, a high-intensity, co-ed, full-contact sport dominated by the fastest, fiercest animals in the world.",97.3138,/wfuqMlaExcoYiUEvKfVpUTt1v4u.jpg,2026-02-11,False,False,8.117,728,100.0,90000000.0,193566330.0,Released,You're never too small to dream big.,Tyree Dillihay
False,/oTE4lNs4PSG5iIWjqaTdCIFJ4Bs.jpg,"28,53",1318447,Apex,en,Apex,A grieving woman pushing her limits on a solo adventure in the Australian wild is ensnared in a twisted game with a cunning killer who thinks she's prey.,97.0693,/eTp7gSPkSF3Aw79mNx1NkBP1PZT.jpg,2026-04-24,False,False,6.744,1349,96.0,0.0,0.0,Released,Hunt. Survive.,Baltasar Kormákur
False,/eQySd26OW7UmCuaeBOL7qy6foMn.jpg,"28,14,878",454639,Masters of the Universe,en,Masters of the Universe,"After being separated for 15 years, the Sword of Power leads Prince Adam back to Eternia, where he discovers his home shattered under the fiendish rule of Skeletor. To save his family and his world, Adam must join forces with his closest allies, Teela and Duncan/Man-At-Arms, and embrace his true destiny as He-Man — the most powerful man in the universe.",91.1325,/3YMd9Ogae4rDKLWuAZFuse9xhc5.jpg,2026-06-03,False,False,7.482,28,141.0,200000000.0,0.0,Released,Witness how he became He-Man.,Travis Knight
False,/A2tzVTVtnTvpji96IZmleN78KKv.jpg,"27,35",1239134,Bhooth Bangla,hi,भूत बंगला,"A man inherits a palace in rural Mangalpur and plans his sister's wedding there, but strange supernatural events and panicked locals force him to investigate the property's mysterious past.",85.4761,/79RBp8afL4u4z3nVGR78z6eIvBB.jpg,2026-04-16,False,False,6.5,10,163.0,14000000.0,20000000.0,Released,,Priyadarshan
False,/4DfxcN4w0FuYZHQ3JAHzpHWia1U.jpg,"28,80,53",1291608,Dhurandhar,hi,धुरंधर,"A mysterious traveler slips into the heart of Karachi's underbelly and rises through its ranks with lethal precision, only to tear the notorious ISI-Underworld nexus apart from within.",84.3862,/8FHOtUpNIk5ZPEay2N2EY5lrxkv.jpg,2025-12-05,False,False,7.2,293,212.0,14330000.0,170000000.0,Released,,Aditya Dhar
False,/aqqoDJs8vYp2EZ74aQ1UMY0sjM7.jpg,"18,53",235271,Addicted,en,Addicted,A gallerist risks her family and flourishing career when she enters into an affair with a talented painter and slowly loses control of her life.,83.3161,/fAERrD6vvmznDoL99wlgjhSfPcH.jpg,2014-10-10,False,False,5.918,446,105.0,0.0,17534314.0,Released,Every Woman Needs an Escape,Bille Woodruff
False,/9qYPmrdpGT58hd3wSam82pmPIoW.jpg,"27,53",1571594,The Photographer,es,La fotógrafa,"Inna, a young post-mortem photographer, arrives at a remote orphanage in northern Spain to capture the final image of Alejandra, a girl found dead under mysterious circumstances. But as her lens lingers on the tragedy, Inna begins to sense a dark presence within the orphanage's walls-an evil that refuses to remain hidden and threatens to make her its next subject.",80.5835,/95pZ9yB5SABddzaINITvZd7SvER.jpg,2025-10-30,False,False,7.0,2,70.0,0.0,0.0,Released,,Carlos Marbán
False,/lgotja3xMoJZbynwHfcQcJAEMWH.jpg,"12,16,35,10751,9648",1084242,Zootopia 2,en,Zootopia 2,"After cracking the biggest case in Zootopia's history, rookie cops Judy Hopps and Nick Wilde find themselves on the twisting trail of a great mystery when Gary De'Snake arrives and turns the animal metropolis upside down. To crack the case, Judy and Nick must go undercover to unexpected new parts of town, where their growing partnership is tested like never before.",79.9715,/oJ7g2CifqpStmoYQyaLQgEU32qO.jpg,2025-11-26,False,False,7.651,2872,108.0,150000000.0,1868208796.0,Released,They're back with a twissst.,Jared Bush
False,/hlZGaey4lR9hc4rGxZRAmIEsZOc.jpg,"28,18",1292415,Beast,en,Beast,"MMA legend Patton James, now a commercial fisherman, is pulled back into the cage when his brother is in danger. Reuniting with his old coach Sammy, he commits to one final fight in one championship against the brutal champion Xavier Grau.",79.2897,/7NrvUI3vnW8H3rD7ExKcTL7KRcQ.jpg,2026-04-10,False,False,6.223,47,114.0,0.0,0.0,Released,Legends are made in the cage.,Tyler Atkins
False,/7TJjD2X9GTEqyLVIJKLS85J2V47.jpg,"53,28,80",28322,Madness,it,Vacanze per un massacro,"An escaped convicted murderer invades the cottage of a man, his wife and the wife's sister, whereupon he proceeds to torment this already dysfunctional trio with rape and violence.",78.6819,/gV0J0Fqw2mYMtQbzb0ruxv9MAeZ.jpg,1980-03-20,False,False,4.969,32,89.0,0.0,0.0,Released,,Fernando Di Leo
False,/pjlxrd646cBYznHoPBWTzz6FujX.jpg,"28,878,18",39254,Real Steel,en,Real Steel,"Charlie Kenton is a washed-up fighter who retired from the ring when robots took over the sport. After his robot is trashed, he reluctantly teams up with his estranged son to rebuild and train an unlikely contender.",77.835,/4GIeI5K5YdDUkR3mNQBoScpSFEf.jpg,2011-09-28,False,False,7.095,9167,127.0,110000000.0,299300000.0,Released,Courage is stronger than steel.,Shawn Levy
False,/l1nekhf05HS5OpBr0vRqcD3NxoS.jpg,"36,80,28,14",1103473,KD – The Devil,kn,ಕೆಡಿ - ದಿ ಡೆವಿಲ್,"In the early 1970s, a petty criminal Kaali unwittingly involves himself with underworld thugs, catalyzing events beyond his control.",77.7206,/nEuEMJrnLBneE9tJlmzbhCFLu95.jpg,2026-04-30,False,False,5.0,1,141.0,0.0,0.0,Released,I MEAN IT'S BETTER THAN MARTIN,Prem
False,/mxdiaM2tsx8M6W3zLgiPwAkhQfq.jpg,"18,10749",744275,After We Fell,en,After We Fell,"Just as Tessa's life begins to become unglued, nothing is what she thought it would be. Not her friends nor her family. The only person that she should be able to rely on is Hardin, who is furious when he discovers the massive secret that she's been keeping. Before Tessa makes the biggest decision of her life, everything changes because of revelations about her family.",76.9805,/dU4HfnTEJDf9KvxGS9hgO7BVeju.jpg,2021-09-01,False,False,7.004,2743,99.0,14000000.0,21753705.0,Released,,Castille Landon
False,,"35,18",1699574,Deool Band 2,mr,देऊळ बँड 2,"The story follows a farmer who decides to question and test his faith, setting off a journey filled with emotional and life-altering moments. At its core, the narrative centers on a woman who tirelessly struggles for her family, facing hardships with resilience, as her path ultimately leads her to confront the very idea of divine power",75.6567,/89n9cfc5dm0kdkABmDJalzveEwU.jpg,2026-05-21,False,False,0.0,0,182.0,0.0,0.0,Released,,Pravin Tarde
False,/61RYedFgX1K07xgVIvdJzukSR4g.jpg,"35,18,10751,10749",848116,Rocky Aur Rani Kii Prem Kahaani,hi,रॉकी और रानी की प्रेम कहानी,"Gym-freak brat Rocky falls in love with Rani, who comes from a well-educated Bengali family. Being from polar opposite worlds, the two decide to switch their families to adjust to each other's cultures and backgrounds and to know if their marriage will survive. Rocky and Rani are trapped in a world where they are united by love but divided by families and the ultimate question is will they fit in?",73.7499,/vTQIqlxUkOuyf2UKhlM2OUaFGKz.jpg,2023-07-28,False,False,6.142,88,178.0,0.0,0.0,Released,The power of family will decide the fate of love,Karan Johar
